Name,year,Temp_13,Windspeed_13,dew_point_13,adiabatic_saturation_13,soil_moisture_13,max_air_temp_13,min_air_temp_13,max_windspeed_13,min_windspeed_13,total_precip_13,h_i_rad_intensity_13
Abraham Lincoln Birthplace National Historical Park,2012,14.82,1.7,9.64,12.23,0.67,41.23,-13.56,7.27,0.03,5.27,332.63
Adams National Historical Park,2012,10.79,0.63,6.73,8.76,0.62,35.34,-14.68,2.62,0.01,0.0,313.15
African Burial Ground National Monument,2012,13.48,4.09,9.71,11.59,0.62,31.75,-6.57,20.23,0.05,0.0,325.52
Agate Fossil Beds National Monument,2012,11.4,3.64,-1.09,5.15,0.34,40.36,-14.44,13.68,0.04,0.0,297.77
Alibates Flint Quarries National Monument,2012,16.66,3.55,2.25,9.46,0.32,42.87,-8.23,12.16,0.03,0.0,319.53
Allegheny Portage Railroad National Historic Site,2012,10.36,0.27,6.36,8.36,0.66,34.15,-14.42,2.18,0.0,5.27,317.5
Amistad National Recreation Area,2012,22.33,3.39,9.95,16.14,0.38,42.94,-1.16,11.56,0.02,0.0,360.69
Andersonville National Historic Site,2012,19.43,1.81,13.46,16.44,0.45,41.63,-6.35,7.11,0.03,0.0,354.27
Andrew Johnson National Historic Site,2012,14.12,0.62,9.38,11.75,0.71,38.91,-8.94,2.59,0.02,5.27,330.98
Aniakchak National Monument and Preserve,2012,-0.88,4.18,-2.34,-1.61,0.82,21.06,-28.91,14.83,0.03,5.27,286.53
Antietam National Battlefield,2012,12.83,1.73,8.32,10.58,0.67,39.65,-11.39,7.57,0.04,5.27,326.98
Apostle Islands National Lakeshore,2012,7.62,3.67,4.26,5.94,0.56,27.26,-14.8,12.27,0.04,0.0,307.05
Appomattox Court House National Historical Park,2012,14.43,0.11,9.06,11.75,0.66,40.19,-7.29,1.19,0.0,0.0,334.52
Arches National Park,2012,11.9,2.37,-3.39,4.26,0.34,37.21,-14.1,11.5,0.02,0.0,289.08
Arkansas Post National Memorial,2012,18.5,2.31,12.78,15.64,0.73,42.5,-5.53,9.19,0.07,5.27,350.75
Assateague Island National Seashore,2012,15.68,4.86,12.05,13.87,0.77,31.12,-2.21,19.78,0.04,5.27,336.8
Aztec Ruins National Monument,2012,11.21,2.33,-3.01,4.1,0.36,35.9,-19.66,10.3,0.04,0.0,283.58
Badlands National Park,2012,12.53,3.32,0.69,6.61,0.43,43.76,-18.59,13.45,0.04,0.0,309.24
Bandelier National Monument,2012,9.01,1.43,-3.27,2.87,0.38,34.88,-18.9,6.18,0.06,0.0,287.95
Bent's Old Fort National Historic Site,2012,15.1,3.29,-0.2,7.45,0.32,43.36,-9.1,13.17,0.05,0.0,301.41
Bering Land Bridge National Preserve,2012,-7.24,2.91,-8.63,-7.93,0.73,20.34,-42.69,11.89,0.09,0.0,247.09
Big Bend National Park,2012,20.73,2.26,5.19,12.96,0.32,41.8,-2.6,9.26,0.02,0.0,339.91
Big Cypress National Preserve,2012,23.98,2.54,19.1,21.54,0.41,33.81,1.58,9.41,0.02,5.27,397.41
Big Hole National Battlefield,2012,2.82,0.39,-2.87,-0.02,0.48,30.56,-23.02,1.54,0.01,0.0,265.7
Big South Fork National River and Recreation Area,2012,14.09,0.16,9.48,11.79,0.66,39.52,-9.39,1.23,0.0,5.27,331.27
Big Thicket National Preserve,2012,20.94,0.11,15.78,18.36,0.71,41.9,-3.56,1.07,0.0,5.27,371.24
Bighorn Canyon National Recreation Area,2012,7.37,2.57,-2.91,2.23,0.37,35.84,-19.11,10.6,0.02,0.0,298.76
Black Canyon Of The Gunnison National Park,2012,5.94,0.79,-4.99,0.48,0.42,32.58,-22.13,3.2,0.01,0.0,270.94
Blue Ridge Parkway,2012,13.3,0.36,8.94,11.12,0.73,38.07,-9.86,1.67,0.01,5.27,322.62
Bluestone National Scenic River,2012,11.62,0.18,7.31,9.47,0.62,34.85,-12.47,1.33,0.0,0.0,321.51
Booker T Washington National Monument,2012,13.5,0.26,8.37,10.94,0.66,37.96,-8.97,1.45,0.01,0.0,326.53
Boston National Historical Park,2012,10.79,0.63,6.73,8.76,0.62,35.34,-14.68,2.62,0.01,0.0,313.15
Boston African American National Historic Site,2012,10.79,0.63,6.73,8.76,0.62,35.34,-14.68,2.62,0.01,0.0,313.15
Bryce Canyon National Park,2012,11.1,2.62,-4.12,3.49,0.3,35.61,-13.35,11.19,0.07,0.0,269.21
Buck Island Reef National Monument,2012,27.33,5.45,23.01,25.17,1.0,29.48,24.45,12.03,0.32,0.0,409.93
Buffalo National River,2012,15.68,0.33,9.44,12.55,0.64,41.15,-11.34,1.2,0.02,0.0,337.46
Cabrillo National Monument,2012,16.62,2.74,13.06,14.83,0.74,30.26,10.17,10.42,0.02,0.0,348.98
Canaveral National Seashore,2012,23.63,4.56,19.16,21.4,0.59,30.58,7.87,13.76,0.04,5.27,387.73
Cane River Creole National Historical Park,2012,19.85,0.51,15.11,17.48,0.66,41.12,-4.75,2.09,0.02,5.27,365.28
Canyonlands National Park,2012,12.09,2.52,-3.46,4.32,0.3,36.55,-12.63,11.93,0.02,0.0,289.08
Cape Cod National Seashore,2012,11.9,5.32,8.82,10.36,0.77,26.4,-5.77,18.75,0.05,5.27,324.69
Cape Hatteras National Seashore,2012,19.01,4.94,15.15,17.08,0.72,30.87,0.4,14.46,0.15,5.27,363.31
Cape Krusenstern National Monument,2012,-7.56,3.62,-8.92,-8.24,0.81,20.39,-45.04,10.81,0.07,0.0,239.99
Cape Lookout National Seashore,2012,19.4,4.11,15.43,17.41,0.69,31.69,-0.28,11.5,0.13,5.27,368.39
Capitol Reef National Park,2012,9.89,2.49,-4.87,2.51,0.3,34.74,-15.55,10.45,0.04,0.0,272.87
Capulin Volcano National Monument,2012,13.06,3.76,-2.04,5.51,0.35,38.78,-11.21,13.0,0.05,0.0,293.91
Carl Sandburg Home National Historic Site,2012,13.3,0.36,8.94,11.12,0.73,38.07,-9.86,1.67,0.01,5.27,322.62
Carlsbad Caverns National Park,2012,18.51,3.11,1.37,9.94,0.27,41.01,-4.7,13.6,0.12,0.0,317.87
Casa Grande Ruins National Monument,2012,21.38,2.14,1.67,11.53,0.29,44.39,-0.96,8.0,0.02,0.0,331.78
Castle Clinton National Monument,2012,13.48,4.09,9.71,11.59,0.62,31.75,-6.57,20.23,0.05,0.0,325.52
Catoctin Mountain Park,2012,12.83,1.73,8.32,10.58,0.67,39.65,-11.39,7.57,0.04,5.27,326.98
Cedar Breaks National Monument,2012,9.77,1.69,-3.72,3.03,0.38,35.19,-15.21,7.49,0.02,0.0,269.21
Chaco Culture National Historical Park,2012,11.82,2.69,-2.92,4.45,0.34,36.3,-13.76,12.13,0.05,0.0,283.58
Chamizal National Memorial,2012,18.07,2.78,-0.38,8.84,0.23,40.33,-6.12,12.41,0.03,0.0,316.73
Channel Islands National Park,2012,15.37,4.29,11.22,13.3,0.41,25.98,8.48,11.56,0.05,0.0,334.6
Charles Pinckney National Historic Site,2012,19.34,1.32,14.7,17.02,0.62,38.87,-3.52,4.0,0.03,5.27,373.75
Chattahoochee River National Recreation Area,2012,17.08,1.04,11.65,14.36,0.62,42.13,-7.02,4.02,0.02,0.0,346.81
Chesapeake and Ohio Canal National Historical Park,2012,13.74,1.84,8.85,11.3,0.66,40.65,-7.93,8.09,0.05,0.0,326.98
Chickamauga and Chattanooga National Military Park,2012,16.35,0.48,11.44,13.9,0.7,41.73,-6.5,1.73,0.01,5.27,341.62
Chickasaw National Recreation Area,2012,18.28,3.21,10.29,14.28,0.49,45.4,-8.62,10.16,0.05,0.0,343.38
Chiricahua National Monument,2012,16.76,2.42,-0.21,8.28,0.31,39.48,-5.69,11.03,0.03,0.0,304.71
Christiansted National Historic Site,2012,27.48,5.34,23.04,25.26,0.83,29.85,24.6,12.74,0.32,0.0,409.93
City Of Rocks National Reserve,2012,8.3,2.68,-2.7,2.8,0.46,36.55,-17.41,11.75,0.02,0.0,292.21
Clara Barton National Historic Site,2012,14.26,2.56,9.38,11.83,0.63,40.24,-8.0,11.68,0.05,0.0,331.28
Colonial National Historical Park,2012,15.85,1.15,11.15,13.5,0.71,40.95,-6.17,4.29,0.03,5.27,339.29
Colorado National Monument,2012,10.87,2.36,-3.12,3.87,0.4,36.66,-18.93,11.59,0.03,0.0,275.34
Congaree National Park,2012,18.27,2.16,12.44,15.36,0.45,42.4,-5.82,8.69,0.04,5.27,355.3
Coronado National Memorial,2012,16.89,2.41,0.44,8.66,0.34,39.23,-5.38,10.98,0.05,0.0,300.0
Cowpens National Battlefield,2012,16.34,1.29,11.01,13.67,0.64,41.0,-6.12,5.37,0.02,5.27,336.73
Crater Lake National Park,2012,5.18,0.18,0.55,2.87,0.52,30.98,-17.27,1.38,0.0,5.27,290.34
Craters Of The Moon National Monument and Preserve,2012,10.08,2.71,-1.72,4.19,0.45,39.25,-13.62,13.68,0.05,0.0,271.79
Cumberland Gap National Historical Park,2012,14.45,0.32,9.64,12.05,0.67,40.37,-8.44,1.53,0.0,5.27,331.7
Cumberland Island National Seashore,2012,21.41,3.46,17.41,19.41,0.42,30.9,2.62,9.35,0.01,5.27,375.48
Curecanti National Recreation Area,2012,5.94,0.79,-4.99,0.48,0.42,32.58,-22.13,3.2,0.01,0.0,270.94
Cuyahoga Valley National Park,2012,11.77,3.96,7.52,9.65,0.71,32.35,-8.98,14.6,0.11,0.0,330.07
Dayton Aviation Heritage National Historical Park,2012,12.05,2.94,7.41,9.73,0.72,38.6,-12.52,11.52,0.03,0.0,323.34
De Soto National Memorial,2012,23.12,2.87,18.26,20.69,0.48,33.65,2.68,9.98,0.02,5.27,386.91
Death Valley National Park,2012,19.51,2.07,-2.53,8.49,0.21,44.95,-3.6,10.03,0.02,0.0,288.62
Delaware Water Gap National Recreation Area,2012,10.9,0.23,6.95,8.93,0.64,35.69,-13.55,1.75,0.0,5.27,315.96
Denali National Park and Preserve,2012,-4.74,2.05,-7.67,-6.2,0.72,19.5,-37.63,11.42,0.04,0.0,253.66
Devils Postpile National Monument,2012,7.55,0.52,-3.56,2.0,0.48,31.6,-18.83,1.62,0.01,0.0,277.34
Devils Tower National Monument,2012,9.88,3.45,-0.95,4.47,0.39,39.71,-16.81,11.55,0.05,0.0,291.5
Dinosaur National Monument,2012,9.63,2.67,-4.1,2.76,0.33,35.98,-16.73,13.41,0.02,0.0,278.12
Edgar Allan Poe National Historic Site,2012,13.04,1.83,8.83,10.94,0.64,38.26,-10.9,9.29,0.04,5.27,330.44
Effigy Mounds National Monument,2012,10.32,3.27,4.44,7.38,0.59,40.64,-20.06,12.23,0.05,0.0,311.48
Eisenhower National Historic Site,2012,11.9,1.03,7.62,9.76,0.7,38.24,-12.95,4.55,0.01,5.27,326.98
El Malpais National Monument,2012,10.89,3.09,-3.67,3.61,0.34,34.8,-14.38,12.44,0.04,0.0,284.12
El Morro National Monument,2012,10.89,3.09,-3.67,3.61,0.34,34.8,-14.38,12.44,0.04,0.0,280.55
Eleanor Roosevelt National Historic Site,2012,10.19,0.21,6.39,8.29,0.66,35.65,-18.34,1.56,0.0,5.27,317.14
Eugene O'Neill National Historic Site,2012,14.51,2.8,7.27,10.89,0.38,42.14,-3.25,8.77,0.02,0.0,322.96
Everglades National Park,2012,25.23,4.21,20.19,22.71,0.48,31.7,8.77,13.37,0.03,5.27,401.77
Federal Hall National Memorial,2012,13.48,4.09,9.71,11.59,0.62,31.75,-6.57,20.23,0.05,0.0,325.52
Fire Island National Seashore,2012,13.61,4.99,10.08,11.84,0.77,28.75,-5.66,22.85,0.09,5.27,329.8
First Ladies National Historic Site,2012,11.25,1.1,6.57,8.9,0.7,36.98,-11.44,5.53,0.01,0.0,320.59
Flight 93 National Memorial,2012,10.8,0.28,6.54,8.66,0.66,35.54,-13.11,2.08,0.0,0.0,317.5
Florissant Fossil Beds National Monument,2012,8.44,2.7,-4.23,2.1,0.37,34.42,-15.99,12.28,0.05,0.0,266.61
Fort Bowie National Historic Site,2012,16.76,2.42,-0.21,8.28,0.31,39.48,-5.69,11.03,0.03,0.0,304.71
Fort Davis National Historic Site,2012,17.87,3.2,2.72,10.3,0.34,40.2,-4.86,12.03,0.06,0.0,318.84
Fort Donelson National Battlefield,2012,16.34,1.3,10.51,13.42,0.71,42.73,-7.78,5.55,0.01,0.0,338.26
Fort Frederica National Monument,2012,21.41,3.46,17.41,19.41,0.42,30.9,2.62,9.35,0.01,5.27,370.77
Fort Laramie National Historic Site,2012,12.13,3.56,-1.49,5.32,0.33,40.94,-12.1,14.16,0.09,0.0,299.79
Fort Larned National Historic Site,2012,15.23,3.59,4.43,9.83,0.41,45.08,-13.27,12.37,0.05,0.0,321.45
Fort Matanzas National Monument,2012,21.94,1.61,17.59,19.76,0.45,34.98,1.99,4.71,0.07,5.27,378.44
Fort Necessity National Battlefield,2012,10.75,0.41,6.63,8.69,0.7,35.6,-11.95,2.55,0.01,5.27,320.82
Fort Point National Historic Site,2012,13.08,2.33,8.49,10.79,0.54,34.3,1.39,7.81,0.05,0.0,322.96
Fort Pulaski National Monument,2012,21.08,4.7,16.93,19.01,0.53,31.12,2.01,13.12,0.1,0.0,365.19
Fort Raleigh National Historic Site,2012,17.69,4.43,14.04,15.87,0.7,32.45,-0.48,14.04,0.02,5.27,363.31
Fort Scott National Historic Site,2012,15.37,3.19,8.33,11.86,0.6,43.55,-11.95,11.7,0.01,0.0,334.02
Fort Smith National Historic Site,2012,17.55,1.81,10.71,14.12,0.62,42.69,-7.24,6.98,0.02,0.0,343.29
Fort Stanwix National Monument,2012,9.1,0.45,5.48,7.29,0.72,33.51,-25.63,3.53,0.0,0.0,315.12
Fort Union National Monument,2012,10.83,1.68,-3.51,3.66,0.32,35.77,-12.7,6.52,0.04,0.0,283.58
Fort Union Trading Post National Historic Site,2012,8.31,3.65,0.15,4.23,0.44,39.21,-25.13,13.03,0.05,0.0,296.29
Fort Vancouver National Historic Site,2012,10.17,0.8,6.6,8.39,0.78,38.24,-5.03,3.11,0.02,5.27,312.21
Fossil Butte National Monument,2012,4.73,1.93,-3.79,0.47,0.45,32.01,-25.37,8.3,0.01,0.0,275.16
Franklin Delano Roosevelt Memorial,2012,14.26,2.56,9.38,11.83,0.63,40.24,-8.0,11.68,0.05,0.0,331.28
Frederick Douglass National Historic Site,2012,14.26,2.56,9.38,11.83,0.63,40.24,-8.0,11.68,0.05,0.0,335.09
Frederick Law Olmsted National Historic Site,2012,10.79,0.63,6.73,8.76,0.62,35.34,-14.68,2.62,0.01,0.0,313.15
Friendship Hill National Historic Site,2012,11.79,0.23,7.19,9.49,0.69,38.16,-11.2,1.9,0.0,0.0,320.82
Gates Of The Arctic National Park and Preserve,2012,-11.6,1.86,-12.66,-12.13,0.91,16.42,-43.24,8.05,0.03,0.0,227.98
Gateway National Recreation Area,2012,13.48,4.09,9.71,11.59,0.62,31.75,-6.57,20.23,0.05,0.0,329.8
Gauley River National Recreation Area,2012,12.49,0.2,7.87,10.18,0.63,37.18,-11.87,1.34,0.0,5.27,330.86
General Grant National Memorial,2012,12.1,1.54,8.16,10.13,0.59,35.92,-12.72,8.05,0.02,5.27,329.8
George Rogers Clark National Historical Park,2012,14.51,2.83,8.9,11.71,0.68,42.01,-12.09,11.56,0.08,0.0,330.53
George Washington Birthplace National Monument,2012,15.24,0.74,10.31,12.78,0.7,39.98,-5.99,2.66,0.01,0.0,335.09
George Washington Carver National Monument,2012,15.97,3.01,9.14,12.55,0.67,43.75,-10.88,10.26,0.05,0.0,336.83
Gettysburg National Military Park,2012,11.9,1.03,7.62,9.76,0.7,38.24,-12.95,4.55,0.01,5.27,326.98
Gila Cliff Dwellings National Monument,2012,12.33,1.04,-2.54,4.89,0.41,36.62,-9.02,4.61,0.03,0.0,275.25
Glacier National Park,2012,1.93,0.45,-1.33,0.3,0.67,28.36,-24.88,1.95,0.0,5.27,279.78
Glacier Bay National Park and Preserve,2012,-3.38,2.02,-4.49,-3.94,0.74,13.79,-32.2,15.5,0.04,10.55,281.35
Glen Canyon National Recreation Area,2012,14.38,2.18,-2.84,5.77,0.26,38.73,-8.97,10.81,0.05,0.0,290.23
Golden Gate National Recreation Area,2012,13.08,2.33,8.49,10.79,0.54,34.3,1.39,7.81,0.05,0.0,322.96
Governors Island National Monument,2012,13.48,4.09,9.71,11.59,0.62,31.75,-6.57,20.23,0.05,0.0,325.52
Grand Canyon National Park,2012,12.46,2.25,-2.56,4.94,0.34,36.75,-10.18,11.45,0.05,0.0,285.85
Grand Portage National Monument,2012,5.43,1.98,1.66,3.55,0.47,29.44,-24.67,6.66,0.04,0.0,319.18
Grand Teton National Park,2012,1.34,0.66,-4.28,-1.47,0.54,28.73,-27.54,2.89,0.02,0.0,261.11
Grant-Kohrs Ranch National Historic Site,2012,4.68,1.31,-1.77,1.45,0.51,33.76,-20.48,4.98,0.02,0.0,277.89
Great Basin National Park,2012,9.38,2.44,-4.33,2.52,0.34,36.39,-19.2,12.48,0.05,0.0,275.89
Great Sand Dunes National Park and Preserve,2012,7.45,2.42,-4.52,1.47,0.39,32.87,-21.78,11.16,0.02,0.0,267.41
Great Smoky Mountains National Park,2012,13.58,0.41,9.19,11.39,0.74,38.24,-10.52,1.65,0.01,5.27,325.82
Greenbelt Park,2012,14.26,2.56,9.38,11.83,0.63,40.24,-8.0,11.68,0.05,0.0,335.09
Guadalupe Mountains National Park,2012,17.33,2.96,0.39,8.86,0.27,39.57,-5.52,13.32,0.09,0.0,317.84
Guilford Courthouse National Military Park,2012,15.44,1.91,10.28,12.86,0.64,40.08,-6.32,7.37,0.03,0.0,338.01
Hagerman Fossil Beds National Monument,2012,11.39,2.62,-1.06,5.16,0.43,40.56,-12.98,11.4,0.04,0.0,296.24
Hamilton Grange National Memorial,2012,12.1,1.54,8.16,10.13,0.59,35.92,-12.72,8.05,0.02,5.27,329.8
Hampton National Historic Site,2012,13.17,2.48,8.7,10.94,0.66,39.44,-10.75,11.3,0.02,5.27,326.95
Harpers Ferry National Historical Park,2012,12.83,1.73,8.32,10.58,0.67,39.65,-11.39,7.57,0.04,5.27,326.98
Harry S Truman National Historic Site,2012,14.83,3.2,7.35,11.09,0.56,43.3,-13.31,11.88,0.05,0.0,330.27
Herbert Hoover National Historic Site,2012,12.23,3.18,5.7,8.96,0.58,43.13,-16.45,14.07,0.02,0.0,320.44
Home Of Franklin D Roosevelt National Historic Site,2012,10.19,0.21,6.39,8.29,0.66,35.65,-18.34,1.56,0.0,5.27,317.14
Hopewell Culture National Historical Park,2012,12.61,2.09,7.74,10.18,0.69,38.38,-11.46,9.29,0.02,0.0,323.23
Hopewell Furnace National Historic Site,2012,12.89,0.58,8.37,10.63,0.66,38.9,-11.82,2.84,0.02,0.0,322.69
Horseshoe Bend National Military Park,2012,18.01,0.12,12.57,15.29,0.63,41.51,-6.42,1.17,0.0,5.27,354.55
Hot Springs National Park,2012,17.63,0.21,11.94,14.79,0.69,42.83,-10.22,1.46,0.01,5.27,345.48
Hovenweep National Monument,2012,10.53,1.33,-3.3,3.62,0.36,35.21,-18.16,5.74,0.03,0.0,291.71
Hubbell Trading Post National Historic Site,2012,12.02,2.76,-3.74,4.15,0.29,36.47,-11.99,11.8,0.02,0.0,282.73
Independence National Historical Park,2012,13.04,1.83,8.83,10.94,0.64,38.26,-10.9,9.29,0.04,5.27,330.44
Isle Royale National Park,2012,6.33,4.28,3.48,4.9,0.54,23.79,-16.68,12.79,0.02,0.0,299.27
James A Garfield National Historic Site,2012,11.19,1.01,6.62,8.9,0.71,36.12,-11.07,4.77,0.02,0.0,330.07
Jewel Cave National Monument,2012,10.83,2.91,-1.06,4.89,0.33,40.58,-17.14,11.88,0.05,0.0,298.99
John Day Fossil Beds National Monument,2012,8.15,2.41,0.44,4.3,0.48,35.94,-16.75,9.45,0.03,0.0,284.04
John Muir National Historic Site,2012,14.51,2.8,7.27,10.89,0.38,42.14,-3.25,8.77,0.02,0.0,322.96
Johnstown Flood National Memorial,2012,10.36,0.27,6.36,8.36,0.66,34.15,-14.42,2.18,0.0,5.27,317.5
Joshua Tree National Park,2012,21.3,2.28,0.04,10.67,0.18,45.25,-2.42,9.83,0.02,0.0,332.77
Kalaupapa National Historical Park,2012,24.14,5.48,19.19,21.66,0.36,27.94,19.62,9.91,0.06,0.0,389.48
Katmai National Park and Preserve,2012,-3.03,3.27,-4.49,-3.76,0.88,19.21,-37.9,14.82,0.06,5.27,266.24
Kenai Fjords National Park,2012,-4.64,2.67,-5.49,-5.06,0.84,10.4,-30.77,16.69,0.03,10.55,274.41
Kennesaw Mountain National Battlefield Park,2012,17.08,1.04,11.65,14.36,0.62,42.13,-7.02,4.02,0.02,0.0,346.81
Kings Mountain National Military Park,2012,16.69,0.98,11.02,13.85,0.6,41.51,-5.98,3.91,0.05,0.0,336.73
Knife River Indian Villages National Historic Site,2012,7.74,3.68,0.51,4.12,0.44,39.6,-26.27,13.41,0.03,0.0,300.7
Kobuk Valley National Park,2012,-9.27,3.21,-10.68,-9.98,0.88,20.71,-46.94,12.73,0.07,0.0,233.72
Korean War Veterans Memorial,2012,14.26,2.56,9.38,11.83,0.63,40.24,-8.0,11.68,0.05,0.0,331.28
Lake Clark National Park and Preserve,2012,-4.95,2.21,-7.01,-5.98,0.82,17.98,-36.56,13.22,0.02,5.27,253.38
Lake Mead National Recreation Area,2012,20.17,2.39,0.33,10.25,0.27,45.28,-3.42,11.5,0.05,0.0,309.85
Lake Meredith National Recreation Area,2012,16.66,3.55,2.25,9.46,0.32,42.87,-8.23,12.16,0.03,0.0,319.53
Lake Roosevelt National Recreation Area,2012,8.24,0.7,1.62,4.93,0.42,35.78,-18.41,2.48,0.02,0.0,287.43
Lassen Volcanic National Park,2012,8.0,0.38,-1.74,3.12,0.56,35.03,-14.27,1.29,0.0,5.27,280.6
Lava Beds National Monument,2012,8.69,2.28,-0.24,4.23,0.46,35.19,-20.19,10.62,0.03,0.0,275.56
Lewis and Clark National Historical Park,2012,9.55,1.43,7.59,8.57,0.83,29.73,-1.75,4.56,0.05,5.27,312.05
Lincoln Memorial,2012,14.26,2.56,9.38,11.83,0.63,40.24,-8.0,11.68,0.05,0.0,331.28
Lincoln Boyhood National Memorial,2012,14.75,1.66,9.4,12.08,0.7,42.04,-12.17,7.45,0.02,0.0,328.88
Lincoln Home National Historic Site,2012,13.58,3.2,7.01,10.3,0.61,42.44,-12.25,14.16,0.11,0.0,325.45
Little Bighorn Battlefield National Monument,2012,11.15,2.91,-0.83,5.16,0.38,40.84,-16.0,9.62,0.05,0.0,301.84
Little River Canyon National Preserve,2012,16.43,0.33,11.55,13.99,0.7,41.35,-6.58,1.18,0.01,5.27,341.62
Little Rock Central High School National Historic Site,2012,18.01,0.42,12.18,15.09,0.69,43.42,-8.11,1.51,0.02,5.27,350.6
Lowell National Historical Park,2012,10.79,0.63,6.73,8.76,0.62,35.34,-14.68,2.62,0.01,0.0,313.15
Lyndon B Johnson National Historical Park,2012,19.94,3.16,11.73,15.83,0.53,41.76,-5.64,10.27,0.03,0.0,358.25
Maggie L Walker National Historic Site,2012,15.23,0.81,10.19,12.71,0.67,40.31,-6.17,3.16,0.02,0.0,336.73
Mammoth Cave National Park,2012,15.17,1.74,10.28,12.73,0.71,41.44,-11.12,7.83,0.04,5.27,333.7
Manassas National Battlefield Park,2012,13.74,1.84,8.85,11.3,0.66,40.65,-7.93,8.09,0.05,0.0,331.28
Manzanar National Historic Site,2012,9.11,2.05,-5.15,1.98,0.39,32.48,-17.44,11.47,0.01,0.0,261.27
Marsh - Billings - Rockefeller National Historical Park,2012,7.58,0.23,4.62,6.11,0.62,31.85,-22.04,1.84,0.0,0.0,305.97
Martin Van Buren National Historic Site,2012,9.54,0.24,5.83,7.69,0.69,35.39,-21.95,1.84,0.0,0.0,313.23
Mary McLeod Bethune Council House National Historic Site,2012,14.26,2.56,9.38,11.83,0.63,40.24,-8.0,11.68,0.05,0.0,331.28
Mesa Verde National Park,2012,12.36,2.39,-2.47,4.94,0.36,37.19,-15.49,11.02,0.02,0.0,270.41
Minute Man National Historical Park,2012,10.79,0.63,6.73,8.76,0.62,35.34,-14.68,2.62,0.01,0.0,313.15
Minuteman Missile National Historic Site,2012,12.22,3.55,0.95,6.58,0.44,44.13,-18.92,14.25,0.02,0.0,309.24
Mojave National Preserve,2012,18.08,2.53,-1.68,8.2,0.2,42.37,-4.34,11.31,0.04,0.0,307.09
Monocacy National Battlefield,2012,12.83,1.73,8.32,10.58,0.67,39.65,-11.39,7.57,0.04,5.27,326.98
Montezuma Castle National Monument,2012,16.57,2.12,-0.23,8.17,0.4,40.14,-6.85,8.16,0.01,0.0,288.72
Moores Creek National Battlefield,2012,17.7,0.21,13.04,15.37,0.67,42.16,-6.55,1.15,0.0,5.27,351.14
Morristown National Historical Park,2012,11.39,0.45,7.39,9.39,0.64,36.48,-13.29,2.15,0.01,5.27,325.52
Mount Rainier National Park,2012,5.9,0.2,3.12,4.51,0.73,33.03,-17.06,1.41,0.0,5.27,282.94
Mount Rushmore National Memorial,2012,8.23,0.93,-1.81,3.21,0.37,37.38,-19.43,3.7,0.02,0.0,298.99
Muir Woods National Monument,2012,13.08,2.33,8.49,10.79,0.54,34.3,1.39,7.81,0.05,0.0,322.96
Natchez National Historical Park,2012,19.48,0.77,15.1,17.3,0.73,41.28,-5.24,3.73,0.04,5.27,364.81
Natchez Trace Parkway,2012,17.91,2.0,12.66,15.29,0.76,43.39,-6.06,8.41,0.07,5.27,352.17
Natural Bridges National Monument,2012,12.87,2.42,-3.2,4.83,0.28,37.18,-10.97,11.61,0.02,0.0,302.69
Navajo National Monument,2012,11.91,2.88,-3.69,4.12,0.27,35.45,-11.76,12.86,0.04,0.0,281.29
New Bedford Whaling National Historical Park,2012,12.43,5.03,8.9,10.66,0.56,30.37,-8.01,21.41,0.04,0.0,324.69
New Orleans Jazz National Historical Park,2012,21.71,3.18,17.55,19.62,0.69,34.84,1.48,16.98,0.1,5.27,379.46
Nez Perce National Historical Park,2012,6.21,0.27,0.9,3.56,0.55,35.71,-18.14,1.45,0.01,5.27,284.66
Nicodemus National Historic Site,2012,14.63,3.45,3.57,9.1,0.37,46.58,-14.13,11.64,0.04,0.0,320.05
Ninety Six National Historic Site,2012,17.94,0.42,12.06,15.01,0.54,43.57,-6.47,1.46,0.01,0.0,344.88
Niobrara National Scenic River,2012,12.19,3.73,1.42,6.8,0.38,44.11,-20.01,13.87,0.04,0.0,310.38
Noatak National Preserve,2012,-10.01,3.23,-11.52,-10.77,0.69,21.43,-49.45,10.88,0.06,0.0,234.91
North Cascades National Park,2012,2.76,0.25,0.48,1.62,0.7,30.49,-21.68,1.55,0.0,5.27,281.1
Olympic National Park,2012,6.71,0.59,4.23,5.47,0.72,32.0,-9.2,1.95,0.0,5.27,306.38
Organ Pipe Cactus National Monument,2012,22.31,2.62,4.94,13.63,0.27,44.28,1.71,8.78,0.09,0.0,329.46
Padre Island National Seashore,2012,24.36,4.0,18.89,21.62,0.3,36.93,5.47,10.39,0.2,0.0,387.93
Palo Alto Battlefield National Historical Park,2012,25.15,3.73,18.6,21.87,0.36,39.45,5.95,9.8,0.09,0.0,393.95
Pea Ridge National Military Park,2012,15.93,1.32,9.19,12.56,0.69,41.65,-11.7,4.77,0.02,0.0,336.83
Pecos National Historical Park,2012,11.26,2.88,-3.09,4.09,0.35,35.98,-12.68,11.12,0.05,0.0,283.58
Petersburg National Battlefield,2012,15.52,0.09,10.58,13.05,0.67,41.36,-6.61,1.17,0.0,5.27,336.73
Petrified Forest National Park,2012,13.9,2.42,-2.62,5.64,0.27,38.48,-8.1,10.93,0.05,0.0,287.88
Petroglyph National Monument,2012,14.32,2.27,-2.13,6.09,0.29,39.4,-9.59,11.77,0.01,0.0,287.95
Pictured Rocks National Lakeshore,2012,7.28,2.66,4.08,5.68,0.52,28.74,-16.39,9.54,0.06,0.0,314.16
Pinnacles National Park,2012,14.73,2.12,5.33,10.03,0.42,42.4,-3.16,7.33,0.01,0.0,303.59
Pipe Spring National Monument,2012,12.07,2.33,-3.11,4.48,0.32,37.51,-10.96,10.39,0.04,0.0,285.85
Pipestone National Monument,2012,9.85,3.67,2.22,6.03,0.41,40.12,-21.99,11.81,0.02,0.0,307.12
Point Reyes National Seashore,2012,12.18,4.21,9.68,10.93,0.73,23.14,5.71,10.84,0.05,0.0,306.37
Port Chicago Naval Magazine National Memorial,2012,14.51,2.8,7.27,10.89,0.38,42.14,-3.25,8.77,0.02,0.0,306.37
President William Jefferson Clinton Birthplace Home National Historic Site,2012,18.99,0.73,12.9,15.94,0.61,42.58,-8.0,2.8,0.01,5.27,356.16
Prince William Forest Park,2012,14.33,0.77,9.3,11.82,0.68,41.18,-6.45,3.32,0.04,0.0,331.28
Rainbow Bridge National Monument,2012,14.38,2.18,-2.84,5.77,0.26,38.73,-8.97,10.81,0.05,0.0,290.23
Richmond National Battlefield Park,2012,15.23,0.81,10.19,12.71,0.67,40.31,-6.17,3.16,0.02,0.0,336.73
Rock Creek Park,2012,14.26,2.56,9.38,11.83,0.63,40.24,-8.0,11.68,0.05,0.0,331.28
Rocky Mountain National Park,2012,4.98,1.38,-5.1,-0.06,0.38,31.84,-20.12,5.73,0.02,0.0,271.4
Rosie the Riveter WWII Home Front National Historical Park,2012,13.08,2.33,8.49,10.79,0.54,34.3,1.39,7.81,0.05,0.0,322.96
Russell Cave National Monument,2012,15.55,0.35,10.94,13.24,0.7,41.21,-7.13,1.44,0.02,5.27,341.62
Sagamore Hill National Historic Site,2012,12.1,1.54,8.16,10.13,0.59,35.92,-12.72,8.05,0.02,5.27,329.8
Saguaro National Park,2012,18.09,2.27,0.64,9.37,0.32,40.71,-4.06,9.29,0.05,0.0,308.32
Saint Croix Island International Historic Site,2012,7.83,2.13,5.38,6.6,0.76,25.77,-15.55,6.84,0.06,5.27,301.88
Saint Paul's Church National Historic Site,2012,12.1,1.54,8.16,10.13,0.59,35.92,-12.72,8.05,0.02,5.27,329.8
Salem Maritime National Historic Site,2012,11.3,2.93,7.86,9.58,0.78,29.88,-9.87,11.12,0.02,5.27,321.04
Salinas Pueblo Missions National Monument,2012,12.85,2.84,-2.8,5.02,0.3,37.79,-12.27,12.63,0.04,0.0,292.55
Salt River Bay National Historical Park and Ecological Preserve,2012,27.44,5.22,22.81,25.13,0.52,29.92,24.14,12.66,0.22,0.0,409.93
San Antonio Missions National Historical Park,2012,21.52,2.7,14.33,17.92,0.56,42.8,-2.63,9.23,0.05,0.0,367.91
San Francisco Maritime National Historical Park,2012,13.08,2.33,8.49,10.79,0.54,34.3,1.39,7.81,0.05,0.0,322.96
San Juan National Historic Site,2012,26.86,3.82,22.2,24.53,0.64,32.16,21.69,9.13,0.02,0.0,415.53
San Juan Island National Historical Park,2012,10.07,2.3,6.82,8.44,0.61,29.95,-3.8,10.59,0.01,5.27,313.44
Sand Creek Massacre National Historic Site,2012,14.33,3.3,0.33,7.33,0.28,43.86,-12.08,14.41,0.05,0.0,306.39
Santa Monica Mountains National Recreation Area,2012,17.31,2.38,8.9,13.11,0.33,34.8,4.91,8.48,0.01,0.0,302.84
Saratoga National Historical Park,2012,9.47,0.27,6.01,7.74,0.67,33.96,-22.6,1.88,0.0,0.0,313.23
Saugus Iron Works National Historic Site,2012,10.79,0.63,6.73,8.76,0.62,35.34,-14.68,2.62,0.01,0.0,313.15
Scotts Bluff National Monument,2012,12.04,3.45,-1.02,5.51,0.32,41.05,-13.21,14.25,0.05,0.0,299.25
Shenandoah National Park,2012,12.23,1.12,7.33,9.79,0.62,38.38,-10.88,5.16,0.03,0.0,325.66
Shiloh National Military Park,2012,16.97,0.52,11.64,14.3,0.68,41.73,-6.65,1.81,0.02,5.27,342.29
