Horseshoe Bend National Military Park,2020,17.51,0.11,13.21,15.36,0.73,39.52,-6.2,1.19,0.0,5.27,355.06
Hot Springs National Park,2020,16.07,0.21,12.62,14.34,0.8,37.5,-5.91,1.16,0.0,5.27,343.29
Hovenweep National Monument,2020,10.58,1.34,-4.0,3.29,0.34,36.44,-14.94,5.65,0.07,0.0,286.08
Hubbell Trading Post National Historic Site,2020,12.18,2.84,-3.31,4.44,0.32,36.73,-11.18,12.03,0.04,0.0,282.88
Independence National Historical Park,2020,12.83,1.91,8.97,10.9,0.65,34.65,-9.66,9.78,0.08,5.27,328.98
Isle Royale National Park,2020,4.73,4.32,2.1,3.41,0.59,22.03,-17.87,12.45,0.09,0.0,291.03
James A Garfield National Historic Site,2020,10.59,1.01,6.3,8.44,0.68,35.81,-16.6,4.55,0.03,0.0,329.71
Jewel Cave National Monument,2020,9.3,2.84,-0.52,4.39,0.4,38.8,-16.38,9.94,0.02,0.0,293.75
John Day Fossil Beds National Monument,2020,8.55,2.36,0.33,4.44,0.45,37.86,-9.81,9.9,0.05,0.0,283.81
John Muir National Historic Site,2020,15.6,2.6,7.63,11.62,0.4,45.01,-2.24,8.08,0.05,0.0,320.45
Johnstown Flood National Memorial,2020,10.24,0.25,5.75,8.0,0.59,34.3,-14.41,2.11,0.0,0.0,318.18
Joshua Tree National Park,2020,21.68,2.3,0.08,10.88,0.19,46.12,-1.55,10.68,0.04,0.0,328.02
Kalaupapa National Historical Park,2020,25.33,5.14,20.12,22.73,0.29,29.23,20.18,11.09,0.08,0.0,394.37
Katahdin Woods and Waters National Monument,2020,4.87,0.3,2.45,3.66,0.69,32.3,-29.54,1.92,0.01,0.0,295.53
Katmai National Park and Preserve,2020,-0.44,3.0,-2.33,-1.38,0.86,21.78,-33.83,13.78,0.01,5.27,271.38
Kenai Fjords National Park,2020,-3.24,2.59,-4.27,-3.75,0.84,15.25,-30.7,18.78,0.04,10.55,276.33
Kennesaw Mountain National Battlefield Park,2020,16.37,1.09,12.37,14.37,0.75,38.05,-5.95,4.11,0.02,5.27,345.08
Keweenaw National Historical Park,2020,5.65,2.57,3.0,4.32,0.62,28.33,-16.69,8.32,0.05,0.0,309.35
Kings Mountain National Military Park,2020,16.47,0.98,12.58,14.52,0.74,35.85,-6.27,4.78,0.02,5.27,334.98
Knife River Indian Villages National Historic Site,2020,6.78,3.73,0.07,3.42,0.45,36.34,-27.66,12.62,0.05,0.0,292.33
Kobuk Valley National Park,2020,-7.44,3.0,-8.91,-8.17,0.87,20.15,-42.94,13.94,0.01,0.0,240.94
Korean War Veterans Memorial,2020,13.79,2.63,9.58,11.69,0.67,36.74,-10.56,10.24,0.05,5.27,330.99
Lake Clark National Park and Preserve,2020,-3.91,2.03,-5.81,-4.86,0.8,17.68,-36.09,15.33,0.02,5.27,257.58
Lake Mead National Recreation Area,2020,20.42,2.32,-0.35,10.04,0.27,45.87,-4.08,10.81,0.05,0.0,309.68
Lake Meredith National Recreation Area,2020,15.87,3.65,3.03,9.44,0.34,44.47,-7.35,12.3,0.11,0.0,319.59
Lake Roosevelt National Recreation Area,2020,8.27,0.69,1.7,4.98,0.43,38.2,-16.6,2.55,0.02,0.0,285.54
Lassen Volcanic National Park,2020,8.98,0.37,-1.82,3.58,0.5,34.77,-12.13,1.32,0.01,0.0,285.27
Lava Beds National Monument,2020,9.42,2.16,-0.43,4.5,0.42,36.23,-10.4,7.94,0.05,0.0,277.63
Lewis and Clark National Historical Park,2020,10.3,1.38,8.26,9.28,0.79,27.33,-1.0,4.27,0.05,5.27,308.95
Lincoln Boyhood National Memorial,2020,13.42,1.59,9.88,11.65,0.78,33.74,-9.89,7.44,0.03,5.27,328.9
Lincoln Home National Historic Site,2020,11.73,3.03,7.34,9.54,0.7,35.69,-18.78,10.68,0.02,0.0,322.75
Lincoln Memorial,2020,13.79,2.63,9.58,11.69,0.67,36.74,-10.56,10.24,0.05,5.27,330.99
Little Bighorn Battlefield National Monument,2020,9.92,2.92,0.31,5.12,0.48,38.71,-16.71,11.96,0.05,0.0,298.91
Little River Canyon National Preserve,2020,15.98,0.33,11.97,13.97,0.76,36.85,-6.63,1.21,0.0,5.27,341.32
Little Rock Central High School National Historic Site,2020,16.34,0.41,12.9,14.62,0.83,37.45,-5.95,1.52,0.01,5.27,348.18
Lowell National Historical Park,2020,10.51,0.66,6.16,8.33,0.62,35.61,-17.42,2.61,0.02,5.27,310.42
Lyndon B Johnson National Historical Park,2020,19.74,3.08,11.73,15.73,0.52,42.99,-4.23,9.38,0.07,0.0,357.28
Maggie L Walker National Historic Site,2020,15.13,0.84,10.97,13.05,0.74,38.62,-6.65,3.73,0.04,5.27,336.33
Mammoth Cave National Park,2020,14.13,1.73,10.72,12.43,0.79,33.04,-8.94,7.74,0.02,5.27,333.23
Manassas National Battlefield Park,2020,13.5,1.93,8.85,11.17,0.65,37.77,-9.47,7.75,0.02,5.27,330.99
Manzanar National Historic Site,2020,9.63,1.9,-4.99,2.32,0.41,33.45,-14.92,10.27,0.02,0.0,266.87
Marsh - Billings - Rockefeller National Historical Park,2020,7.25,0.23,3.98,5.62,0.55,30.97,-29.42,2.01,0.0,0.0,303.54
Martin Van Buren National Historic Site,2020,9.1,0.24,5.37,7.23,0.68,34.41,-23.47,2.25,0.0,5.27,310.14
Mary McLeod Bethune Council House National Historic Site,2020,13.79,2.63,9.58,11.69,0.67,36.74,-10.56,10.24,0.05,5.27,330.99
Mesa Verde National Park,2020,12.33,2.45,-3.06,4.63,0.34,38.48,-11.63,9.95,0.0,0.0,269.3
Minute Man National Historical Park,2020,10.51,0.66,6.16,8.33,0.62,35.61,-17.42,2.61,0.02,5.27,310.42
Minuteman Missile National Historic Site,2020,10.37,3.45,1.87,6.12,0.54,40.76,-17.42,13.3,0.02,0.0,303.3
Mojave National Preserve,2020,18.32,2.52,-1.84,8.24,0.23,43.12,-4.01,10.84,0.05,0.0,304.49
Monocacy National Battlefield,2020,12.7,1.82,7.99,10.34,0.63,37.26,-11.99,7.77,0.09,5.27,326.57
Montezuma Castle National Monument,2020,17.01,2.2,-0.27,8.37,0.41,42.11,-6.48,7.95,0.03,0.0,291.05
Moores Creek National Battlefield,2020,17.8,0.21,14.62,16.21,0.85,39.01,-5.8,1.16,0.01,5.27,353.5
Morristown National Historical Park,2020,11.15,0.45,7.18,9.16,0.62,36.0,-15.95,2.94,0.02,5.27,323.09
Mount Rainier National Park,2020,6.62,0.2,3.72,5.17,0.73,33.9,-10.35,1.27,0.0,5.27,280.74
Mount Rushmore National Memorial,2020,6.8,0.91,-1.38,2.7,0.44,34.86,-22.82,3.76,0.01,0.0,293.75
Muir Woods National Monument,2020,14.58,2.23,8.74,11.66,0.44,39.03,2.92,6.83,0.02,0.0,320.45
Natchez National Historical Park,2020,19.0,0.8,15.37,17.18,0.79,37.55,-4.2,3.56,0.02,5.27,364.02
Natchez Trace Parkway,2020,17.25,2.02,13.22,15.23,0.81,38.72,-6.2,9.27,0.02,5.27,351.77
Natural Bridges National Monument,2020,12.79,2.5,-4.14,4.33,0.26,39.19,-11.64,10.53,0.03,0.0,296.77
Navajo National Monument,2020,12.16,2.98,-4.63,3.76,0.24,37.23,-12.65,12.36,0.02,0.0,279.2
New Bedford Whaling National Historical Park,2020,11.87,5.36,8.65,10.26,0.59,28.83,-7.31,18.2,0.19,5.27,321.63
New Orleans Jazz National Historical Park,2020,21.52,3.43,17.76,19.65,0.7,32.98,2.48,13.12,0.04,5.27,379.15
Nez Perce National Historical Park,2020,5.99,0.29,0.95,3.48,0.52,37.01,-20.74,1.44,0.0,0.0,283.12
Nicodemus National Historic Site,2020,12.74,3.41,4.62,8.68,0.43,39.37,-11.39,11.82,0.08,0.0,315.83
Ninety Six National Historic Site,2020,17.7,0.42,13.51,15.61,0.69,38.03,-6.02,1.58,0.01,5.27,342.24
Niobrara National Scenic River,2020,9.98,3.66,2.63,6.31,0.48,38.57,-19.85,12.73,0.07,0.0,304.77
Noatak National Preserve,2020,-8.09,3.08,-9.66,-8.88,0.74,19.76,-45.1,12.66,0.07,0.0,238.38
North Cascades National Park,2020,3.37,0.23,1.3,2.33,0.71,30.97,-18.78,1.53,0.0,5.27,280.27
Olympic National Park,2020,7.25,0.61,4.93,6.08,0.7,31.95,-7.9,1.77,0.0,5.27,303.79
Organ Pipe Cactus National Monument,2020,22.98,2.69,4.26,13.62,0.23,46.31,-1.57,9.06,0.02,0.0,327.51
Padre Island National Seashore,2020,24.19,3.96,19.24,21.72,0.34,34.96,6.6,15.4,0.05,0.0,386.55
Palo Alto Battlefield National Historical Park,2020,25.01,3.6,18.9,21.96,0.38,38.89,3.09,11.86,0.05,0.0,391.65
Paterson Great Falls National Historical Park,2020,11.15,0.45,7.18,9.16,0.62,36.0,-15.95,2.94,0.02,5.27,323.09
Pea Ridge National Military Park,2020,14.12,1.23,9.95,12.04,0.8,36.05,-8.49,4.37,0.03,5.27,331.63
Pecos National Historical Park,2020,11.26,2.87,-2.69,4.29,0.36,37.86,-11.15,10.38,0.04,0.0,282.45
Perry's Victory and International Peace Memorial,2020,11.17,4.09,7.11,9.14,0.68,31.82,-12.17,14.96,0.06,0.0,331.74
Petersburg National Battlefield,2020,15.53,0.09,11.62,13.57,0.78,39.18,-6.52,1.15,0.0,5.27,336.33
Petrified Forest National Park,2020,14.19,2.51,-2.28,5.95,0.28,39.37,-7.63,10.83,0.03,0.0,288.83
Petroglyph National Monument,2020,14.51,2.31,-1.7,6.4,0.3,39.55,-7.63,9.49,0.02,0.0,288.45
Pictured Rocks National Lakeshore,2020,5.47,2.57,3.16,4.31,0.62,27.98,-17.9,8.61,0.04,0.0,304.09
Pinnacles National Park,2020,15.94,1.95,5.44,10.69,0.38,44.83,-3.43,7.07,0.04,0.0,307.05
Pipe Spring National Monument,2020,12.3,2.41,-4.57,3.87,0.28,38.38,-11.02,9.7,0.03,0.0,287.3
Pipestone National Monument,2020,7.54,3.54,2.87,5.21,0.56,34.88,-29.31,13.99,0.08,0.0,298.49
Point Reyes National Seashore,2020,13.02,3.92,10.18,11.6,0.69,26.57,6.01,11.3,0.06,0.0,312.28
Port Chicago Naval Magazine National Memorial,2020,15.6,2.6,7.63,11.62,0.4,45.01,-2.24,8.08,0.05,0.0,312.28
President William Jefferson Clinton Birthplace Home National Historic Site,2020,17.3,0.7,13.94,15.62,0.77,37.15,-4.34,2.59,0.02,5.27,354.6
Prince William Forest Park,2020,14.12,0.79,9.51,11.82,0.7,38.23,-8.22,3.41,0.02,5.27,330.99
Rainbow Bridge National Monument,2020,14.42,2.2,-3.95,5.23,0.25,40.76,-8.81,10.51,0.02,0.0,288.3
Richmond National Battlefield Park,2020,15.13,0.84,10.97,13.05,0.74,38.62,-6.65,3.73,0.04,5.27,336.33
Rock Creek Park,2020,13.79,2.63,9.58,11.69,0.67,36.74,-10.56,10.24,0.05,5.27,330.99
Rocky Mountain National Park,2020,3.8,1.38,-5.13,-0.67,0.4,29.6,-24.62,5.26,0.02,0.0,267.91
Rosie the Riveter WWII Home Front National Historical Park,2020,14.58,2.23,8.74,11.66,0.44,39.03,2.92,6.83,0.02,0.0,320.45
Russell Cave National Monument,2020,15.08,0.34,11.36,13.22,0.76,35.76,-7.56,1.47,0.01,5.27,341.32
Sagamore Hill National Historic Site,2020,11.89,1.6,7.97,9.93,0.6,34.67,-13.22,7.18,0.02,5.27,326.33
Saguaro National Park,2020,18.66,2.38,1.05,9.86,0.3,41.8,-4.81,9.41,0.04,0.0,310.95
Saint Croix Island International Historic Site,2020,7.3,2.27,4.75,6.02,0.7,26.37,-18.32,8.02,0.01,0.0,299.2
Saint Paul's Church National Historic Site,2020,11.89,1.6,7.97,9.93,0.6,34.67,-13.22,7.18,0.02,5.27,326.33
Salem Maritime National Historic Site,2020,10.93,3.11,7.41,9.17,0.79,31.27,-10.46,10.4,0.02,5.27,316.81
Salinas Pueblo Missions National Monument,2020,13.01,2.92,-1.75,5.62,0.33,37.45,-9.3,10.55,0.09,0.0,295.21
Salt River Bay National Historical Park and Ecological Preserve,2020,27.78,5.26,23.09,25.44,0.44,30.26,24.67,13.18,0.05,0.0,412.49
San Antonio Missions National Historical Park,2020,21.48,2.74,14.19,17.83,0.53,41.54,-1.13,8.56,0.14,0.0,366.64
San Francisco Maritime National Historical Park,2020,14.58,2.23,8.74,11.66,0.44,39.03,2.92,6.83,0.02,0.0,320.45
San Juan Island National Historical Park,2020,10.69,2.34,7.55,9.12,0.61,29.84,-3.71,9.32,0.05,5.27,311.51
San Juan National Historic Site,2020,27.3,3.87,22.58,24.94,0.64,32.49,22.79,10.58,0.05,5.27,415.04
Sand Creek Massacre National Historic Site,2020,13.31,3.34,0.56,6.94,0.29,39.94,-8.95,13.35,0.05,0.0,304.93
Santa Monica Mountains National Recreation Area,2020,17.92,2.38,10.22,14.07,0.45,39.47,5.75,9.45,0.03,0.0,303.29
Saratoga National Historical Park,2020,9.04,0.27,5.44,7.23,0.65,33.63,-24.76,1.98,0.0,0.0,310.14
Saugus Iron Works National Historic Site,2020,10.51,0.66,6.16,8.33,0.62,35.61,-17.42,2.61,0.02,5.27,310.42
Scotts Bluff National Monument,2020,10.55,3.43,-0.77,4.88,0.35,39.94,-15.0,12.34,0.03,0.0,292.34
Shenandoah National Park,2020,12.29,1.2,7.42,9.86,0.59,36.21,-11.32,4.93,0.04,0.0,326.26
Shiloh National Military Park,2020,16.08,0.52,12.36,14.22,0.77,37.11,-7.41,1.79,0.02,5.27,340.61
Sitka National Historical Park,2020,6.95,4.28,4.62,5.79,0.83,23.69,-9.7,15.15,0.03,5.27,295.34
Sleeping Bear Dunes National Lakeshore,2020,8.32,5.34,5.37,6.85,0.66,25.74,-10.52,15.84,0.03,0.0,318.2
Springfield Armory National Historic Site,2020,10.41,0.16,6.04,8.23,0.53,35.93,-17.8,1.32,0.0,5.27,309.36
Steamtown National Historic Site,2020,8.88,0.24,5.46,7.17,0.67,32.36,-19.13,2.27,0.0,5.27,311.96
Stones River National Battlefield,2020,14.94,1.67,11.38,13.16,0.79,34.69,-8.47,7.07,0.06,5.27,337.57
Stonewall National Monument,2020,13.04,4.17,9.67,11.35,0.7,30.68,-6.3,17.27,0.16,5.27,323.09
Sunset Crater Volcano National Monument,2020,14.78,2.52,-2.65,6.06,0.3,40.12,-7.37,10.48,0.04,0.0,281.86
Tallgrass Prairie National Preserve,2020,13.1,3.34,7.23,10.16,0.5,36.75,-14.27,10.66,0.04,0.0,322.01
Thaddeus Kosciuszko National Memorial,2020,12.83,1.91,8.97,10.9,0.65,34.65,-9.66,9.78,0.08,5.27,328.98
Theodore Roosevelt Birthplace National Historic Site,2020,13.04,4.17,9.67,11.35,0.7,30.68,-6.3,17.27,0.16,5.27,326.33
Theodore Roosevelt Inaugural National Historic Site,2020,10.12,1.91,5.71,7.91,0.66,35.34,-16.84,8.18,0.02,0.0,313.3
Theodore Roosevelt National Park,2020,7.53,3.9,0.04,3.79,0.52,37.58,-24.45,12.03,0.08,0.0,290.16
Thomas Edison National Historical Park,2020,11.15,0.45,7.18,9.16,0.62,36.0,-15.95,2.94,0.02,5.27,323.09
Thomas Jefferson Memorial,2020,13.79,2.63,9.58,11.69,0.67,36.74,-10.56,10.24,0.05,5.27,330.99
Thomas Stone National Historic Site,2020,14.56,1.25,10.3,12.43,0.71,37.01,-5.91,4.61,0.05,5.27,330.99
Timpanogos Cave National Monument,2020,10.08,1.95,-2.27,3.91,0.44,37.43,-13.57,7.99,0.02,0.0,276.16
Tonto National Monument,2020,20.67,2.15,1.24,10.96,0.33,44.5,-4.58,7.54,0.04,0.0,328.9
Tuskegee Airmen National Historic Site,2020,18.48,0.44,13.88,16.18,0.7,40.02,-5.78,1.99,0.01,5.27,355.06
Tuskegee Institute National Historic Site,2020,18.48,0.44,13.88,16.18,0.7,40.02,-5.78,1.99,0.01,5.27,355.06
Tuzigoot National Monument,2020,12.79,0.68,-2.14,5.32,0.43,39.25,-9.78,2.13,0.02,0.0,293.46
Ulysses S Grant National Historic Site,2020,12.92,1.1,8.92,10.92,0.73,34.87,-15.98,4.49,0.01,5.27,328.95
Valles Caldera National Preserve,2020,9.17,1.45,-3.49,2.84,0.35,36.06,-16.95,5.45,0.01,0.0,288.45
Valley Forge National Historical Park,2020,12.59,0.59,8.47,10.53,0.68,36.23,-13.12,3.8,0.02,5.27,320.55
Vanderbilt Mansion National Historic Site,2020,9.89,0.21,5.94,7.91,0.65,35.54,-19.29,1.88,0.0,5.27,314.88
Vicksburg National Military Park,2020,18.36,1.95,14.57,16.47,0.77,37.44,-4.39,7.72,0.09,5.27,357.89
Vietnam Veterans Memorial,2020,13.79,2.63,9.58,11.69,0.67,36.74,-10.56,10.24,0.05,5.27,330.99
Virgin Islands National Park,2020,27.65,5.32,23.15,25.4,0.52,29.94,24.57,12.77,0.22,0.0,412.46
Voyageurs National Park,2020,3.83,1.05,-0.0,1.91,0.53,33.66,-37.58,3.47,0.02,0.0,288.02
Waco Mammoth National Monument,2020,19.96,2.8,13.52,16.74,0.59,42.17,-2.7,9.47,0.03,5.27,357.82
Walnut Canyon National Monument,2020,12.29,2.37,-2.18,5.05,0.38,37.33,-11.05,8.62,0.05,0.0,281.86
Washita Battlefield National Historic Site,2020,16.08,3.63,5.88,10.98,0.39,45.26,-7.46,11.05,0.09,0.0,328.77
Whiskeytown National Recreation Area,2020,16.14,0.77,3.38,9.76,0.48,44.09,-2.93,2.89,0.02,0.0,313.65
White Sands National Park,2020,17.15,2.3,0.12,8.63,0.25,41.28,-6.48,10.15,0.05,0.0,315.74
Whitman Mission National Historic Site,2020,12.48,2.74,3.55,8.01,0.42,42.26,-6.37,9.71,0.03,0.0,307.89
William Howard Taft National Historic Site,2020,12.65,0.48,8.44,10.55,0.73,36.46,-11.08,2.45,0.02,5.27,324.21
Wilson's Creek National Battlefield,2020,13.55,1.55,9.72,11.63,0.78,35.74,-10.48,6.02,0.07,5.27,330.1
Wind Cave National Park,2020,9.3,2.84,-0.52,4.39,0.4,38.8,-16.38,9.94,0.02,0.0,293.75
Wolf Trap National Park for the Performing Arts,2020,13.5,1.93,8.85,11.17,0.65,37.77,-9.47,7.75,0.02,5.27,330.99
Women's Rights National Historical Park,2020,10.2,0.84,5.69,7.94,0.64,37.42,-20.38,4.29,0.02,0.0,314.26
World War II Memorial,2020,13.79,2.63,9.58,11.69,0.67,36.74,-10.56,10.24,0.05,5.27,330.99
Wrangell - St Elias National Park and Preserve,2020,-5.62,1.34,-8.51,-7.06,0.73,16.44,-32.87,8.98,0.0,5.27,249.41
Wright Brothers National Memorial,2020,17.7,4.46,14.5,16.1,0.71,31.17,0.43,18.59,0.09,5.27,356.94
Wupatki National Monument,2020,14.78,2.52,-2.65,6.06,0.3,40.12,-7.37,10.48,0.04,0.0,281.86
Yellowstone National Park,2020,0.1,0.66,-4.36,-2.13,0.55,29.05,-28.73,2.27,0.01,0.0,256.32
Yosemite National Park,2020,5.66,1.38,-5.61,0.02,0.45,30.26,-17.88,5.69,0.02,0.0,285.63
Yukon - Charley Rivers National Preserve,2020,-6.22,1.64,-8.07,-7.15,0.75,22.3,-42.95,6.12,0.04,0.0,251.95
Zion National Park,2020,10.01,1.73,-4.92,2.55,0.36,36.55,-13.91,6.3,0.03,0.0,282.04
Abraham Lincoln Birthplace National Historical Park,2021,14.05,1.67,9.86,11.95,0.7,36.15,-15.54,7.13,0.02,3.44,330.13
Adams National Historical Park,2021,10.22,0.66,6.8,8.51,0.68,34.54,-15.93,3.03,0.02,3.64,311.78
African Burial Ground National Monument,2021,12.91,4.04,9.7,11.31,0.73,30.42,-7.27,13.69,0.03,3.8,324.01
Agate Fossil Beds National Monument,2021,10.37,3.55,-0.25,5.05,0.36,39.48,-26.58,14.06,0.08,0.85,294.62
Alibates Flint Quarries National Monument,2021,15.89,3.63,3.49,9.69,0.34,42.42,-17.61,14.18,0.13,1.05,320.06
Allegheny Portage Railroad National Historic Site,2021,10.11,0.26,6.05,8.08,0.61,34.86,-15.11,1.84,0.0,2.62,316.79
Amistad National Recreation Area,2021,21.91,3.29,10.58,16.25,0.41,42.77,-8.73,9.91,0.02,0.67,360.33
Andersonville National Historic Site,2021,18.57,1.7,13.9,16.23,0.55,38.4,-4.63,5.7,0.03,3.47,350.7
Andrew Johnson National Historic Site,2021,13.71,0.62,9.35,11.53,0.73,34.34,-7.76,2.18,0.02,3.46,327.17
Aniakchak National Monument and Preserve,2021,1.53,3.95,-0.03,0.75,0.83,21.8,-24.99,17.51,0.04,3.31,295.83
Antietam National Battlefield,2021,12.73,1.72,8.04,10.38,0.65,37.39,-13.81,6.5,0.05,2.58,325.31
Apostle Islands National Lakeshore,2021,7.37,3.66,4.14,5.76,0.57,27.47,-19.14,11.51,0.06,2.02,301.23
Appomattox Court House National Historical Park,2021,14.33,0.1,8.9,11.62,0.68,37.39,-7.64,1.12,0.0,2.37,331.38
Arches National Park,2021,11.47,2.27,-1.92,4.77,0.39,40.23,-12.89,11.75,0.02,0.91,292.6
Arkansas Post National Memorial,2021,17.38,2.25,12.94,15.16,0.77,39.1,-15.6,7.55,0.03,3.65,348.82
Assateague Island National Seashore,2021,15.18,4.8,11.97,13.58,0.8,29.06,-1.01,12.85,0.05,2.97,334.52
Aztec Ruins National Monument,2021,11.0,2.27,-1.99,4.51,0.38,38.35,-15.81,9.09,0.05,0.98,284.73
Badlands National Park,2021,11.37,3.25,1.67,6.51,0.48,42.23,-22.3,12.96,0.03,1.08,306.36
Bandelier National Monument,2021,9.04,1.42,-2.31,3.37,0.38,35.73,-17.1,5.73,0.05,0.92,290.84
Belmont-Paul Women's Equality National Monument,2021,13.93,2.55,9.26,11.59,0.65,36.5,-9.71,8.42,0.06,2.64,328.61
Bent's Old Fort National Historic Site,2021,14.15,3.12,1.08,7.62,0.35,41.44,-18.92,16.3,0.05,0.97,300.79
Bering Land Bridge National Preserve,2021,-6.17,3.07,-7.52,-6.85,0.79,24.88,-36.95,15.92,0.05,1.62,252.34
Big Bend National Park,2021,20.65,2.38,6.08,13.37,0.34,42.94,-9.92,10.9,0.04,0.61,340.8
Big Cypress National Preserve,2021,24.66,2.48,19.93,22.3,0.42,34.27,4.49,8.3,0.12,2.88,396.32
Big Hole National Battlefield,2021,3.73,0.38,-3.37,0.18,0.41,32.79,-25.16,1.41,0.0,0.93,264.6
Big South Fork National River and Recreation Area,2021,13.49,0.16,9.66,11.58,0.7,35.32,-10.03,1.19,0.0,3.85,328.8
Big Thicket National Preserve,2021,20.16,0.11,16.14,18.15,0.74,39.62,-9.19,1.14,0.0,3.7,368.87
Bighorn Canyon National Recreation Area,2021,6.13,2.53,-1.57,2.28,0.53,36.82,-30.26,10.73,0.07,1.3,296.15
Blue Ridge Parkway,2021,12.98,0.36,8.88,10.93,0.77,32.8,-7.58,1.46,0.0,3.48,317.98
Bluestone National Scenic River,2021,11.7,0.16,6.97,9.33,0.59,34.06,-13.47,1.3,0.0,2.36,318.85
Booker T Washington National Monument,2021,13.33,0.25,8.33,10.83,0.7,35.54,-9.43,1.21,0.01,2.57,323.38
Boston African American National Historic Site,2021,10.22,0.66,6.8,8.51,0.68,34.54,-15.93,3.03,0.02,3.64,311.78
Boston Harbor Islands National Recreation Area,2021,10.22,0.66,6.8,8.51,0.68,34.54,-15.93,3.03,0.02,3.64,319.12
Boston National Historical Park,2021,10.22,0.66,6.8,8.51,0.68,34.54,-15.93,3.03,0.02,3.64,311.78
Bryce Canyon National Park,2021,11.14,2.58,-3.22,3.96,0.33,39.54,-10.46,10.91,0.03,0.61,271.5
Buck Island Reef National Monument,2021,27.46,5.78,22.98,25.22,1.0,30.12,24.65,11.7,0.12,1.32,410.32
Buffalo National River,2021,14.53,0.31,9.92,12.23,0.7,38.12,-18.91,1.42,0.01,3.08,337.32
Cabrillo National Monument,2021,16.77,2.83,13.26,15.02,0.73,26.15,10.82,11.84,0.06,0.54,346.55
Camp Nelson National Monument,2021,13.07,1.98,9.42,11.25,0.76,33.95,-16.28,8.05,0.05,3.41,327.69
Canaveral National Seashore,2021,23.68,4.06,19.7,21.69,0.63,30.97,8.44,10.82,0.08,3.17,389.63
Cane River Creole National Historical Park,2021,18.75,0.5,15.48,17.12,0.77,37.62,-13.43,1.8,0.0,4.35,362.84
Canyonlands National Park,2021,11.87,2.48,-2.24,4.82,0.34,40.26,-10.81,11.66,0.02,0.59,292.6
Cape Cod National Seashore,2021,11.65,5.4,8.56,10.1,0.83,27.44,-7.7,20.97,0.02,3.39,322.63
Cape Hatteras National Seashore,2021,18.48,4.7,14.79,16.64,0.69,30.07,0.9,13.46,0.02,3.43,356.97
Cape Krusenstern National Monument,2021,-6.7,3.73,-8.17,-7.43,0.83,24.37,-38.79,16.34,0.06,1.9,244.85
Cape Lookout National Seashore,2021,18.97,3.9,15.14,17.05,0.71,30.99,0.9,10.23,0.11,3.6,362.98
Capitol Reef National Park,2021,9.59,2.4,-3.3,3.15,0.37,37.97,-14.6,10.24,0.03,0.74,274.44
Capulin Volcano National Monument,2021,12.57,3.68,-0.59,5.99,0.38,37.92,-18.98,15.57,0.02,0.94,294.47
Carl Sandburg Home National Historic Site,2021,12.98,0.36,8.88,10.93,0.77,32.8,-7.58,1.46,0.0,3.48,317.98
Carlsbad Caverns National Park,2021,18.31,3.05,2.99,10.65,0.28,43.16,-10.16,12.74,0.03,0.81,321.5
Carter G. Woodson Home National Historic Site,2021,13.93,2.55,9.26,11.59,0.65,36.5,-9.71,8.42,0.06,2.64,328.61
Casa Grande Ruins National Monument,2021,21.63,2.17,2.28,11.95,0.27,46.18,-1.09,8.94,0.02,0.87,335.78
Castle Clinton National Monument,2021,12.91,4.04,9.7,11.31,0.73,30.42,-7.27,13.69,0.03,3.8,324.01
Catoctin Mountain Park,2021,12.73,1.72,8.04,10.38,0.65,37.39,-13.81,6.5,0.05,2.58,325.31
Cedar Breaks National Monument,2021,9.9,1.7,-3.13,3.38,0.37,38.16,-14.06,6.29,0.03,0.98,271.5
Chaco Culture National Historical Park,2021,11.82,2.69,-1.83,4.99,0.35,37.89,-11.76,10.67,0.07,0.74,284.73
Chamizal National Memorial,2021,17.9,2.73,1.72,9.81,0.26,42.14,-10.5,13.0,0.03,0.75,323.97
Channel Islands National Park,2021,15.36,4.29,11.77,13.57,0.38,23.76,8.1,12.34,0.03,0.96,335.8
Charles Pinckney National Historic Site,2021,19.07,1.27,14.76,16.91,0.69,34.8,-2.01,4.64,0.05,3.3,367.76
Charles Young Buffalo Soldiers National Monument,2021,11.96,2.62,7.7,9.83,0.68,34.9,-17.17,11.7,0.04,2.62,321.72
Chattahoochee River National Recreation Area,2021,16.23,1.03,11.65,13.94,0.7,36.21,-6.3,3.8,0.02,3.68,342.87
Chesapeake and Ohio Canal National Historical Park,2021,13.62,1.85,8.58,11.1,0.64,37.6,-11.51,6.59,0.01,2.37,325.31
Chickamauga and Chattanooga National Military Park,2021,15.65,0.48,11.46,13.55,0.73,36.88,-6.31,1.37,0.01,4.08,338.83
Chickasaw National Recreation Area,2021,17.05,3.12,10.85,13.95,0.52,38.3,-17.06,10.38,0.09,2.38,342.47
Chiricahua National Monument,2021,16.89,2.49,1.08,8.98,0.31,41.22,-6.62,9.86,0.03,0.95,308.84
Christiansted National Historic Site,2021,27.64,5.66,22.98,25.31,0.8,30.25,24.92,11.21,0.32,1.36,410.32
Clara Barton National Historic Site,2021,13.93,2.55,9.26,11.59,0.65,36.5,-9.71,8.42,0.06,2.64,328.61
Colonial National Historical Park,2021,15.49,1.14,11.16,13.33,0.75,35.58,-7.05,4.02,0.01,3.32,336.23
Colorado National Monument,2021,10.45,2.2,-1.88,4.29,0.45,39.3,-16.52,12.17,0.02,1.06,277.63
Congaree National Park,2021,18.15,2.16,12.44,15.3,0.48,36.65,-4.93,7.78,0.03,2.61,352.16
Coronado National Memorial,2021,17.12,2.52,1.42,9.27,0.33,41.4,-5.89,10.92,0.02,1.15,303.09
Cowpens National Battlefield,2021,16.15,1.28,11.03,13.59,0.66,36.38,-4.92,5.03,0.02,2.81,331.78
Crater Lake National Park,2021,6.7,0.18,-0.1,3.3,0.38,36.7,-15.16,1.34,0.0,1.81,290.2
Cumberland Gap National Historical Park,2021,13.98,0.32,9.73,11.86,0.69,35.33,-8.27,1.28,0.0,3.47,328.77
Cumberland Island National Seashore,2021,21.23,3.27,17.47,19.35,0.45,32.07,5.08,10.86,0.08,2.95,375.67
Curecanti National Recreation Area,2021,5.71,0.77,-4.04,0.83,0.44,32.59,-22.27,2.99,0.02,1.13,274.24
Cuyahoga Valley National Park,2021,11.58,3.85,7.3,9.44,0.63,30.71,-11.04,17.02,0.08,2.07,330.46
Dayton Aviation Heritage National Historical Park,2021,11.58,2.86,7.42,9.5,0.7,34.99,-17.95,14.47,0.06,2.79,322.41
De Soto National Memorial,2021,23.48,2.77,18.92,21.2,0.48,33.63,5.22,9.17,0.02,3.4,384.94
Death Valley National Park,2021,20.05,2.17,-2.73,8.65,0.17,46.9,-3.08,11.8,0.02,0.21,296.89
Delaware Water Gap National Recreation Area,2021,10.44,0.23,7.18,8.8,0.67,34.84,-20.45,1.64,0.0,3.47,315.38
Denali National Park and Preserve,2021,-3.74,2.03,-6.38,-5.06,0.84,21.34,-34.58,13.22,0.02,2.17,260.87
Devils Postpile National Monument,2021,8.38,0.52,-3.41,2.48,0.47,35.13,-15.77,1.78,0.0,1.84,283.29
Devils Tower National Monument,2021,9.3,3.3,-0.51,4.4,0.41,41.51,-25.15,13.08,0.05,0.89,289.66
Dinosaur National Monument,2021,9.06,2.54,-3.18,2.94,0.37,38.94,-17.7,12.37,0.02,0.61,279.8
Dwight D. Eisenhower Memorial,2021,13.93,2.55,9.26,11.59,0.65,36.5,-9.71,8.42,0.06,2.64,328.61
Edgar Allan Poe National Historic Site,2021,12.7,1.83,9.05,10.87,0.67,35.71,-11.0,6.95,0.05,3.1,328.93
Effigy Mounds National Monument,2021,9.14,3.12,4.84,6.99,0.66,33.87,-34.15,14.38,0.07,1.99,307.7
Eisenhower National Historic Site,2021,11.69,1.02,7.4,9.55,0.68,37.23,-14.85,4.21,0.02,2.88,325.31
El Malpais National Monument,2021,11.07,3.13,-2.67,4.2,0.32,36.15,-11.67,11.62,0.04,0.71,287.88
El Morro National Monument,2021,11.07,3.13,-2.67,4.2,0.32,36.15,-11.67,11.62,0.04,0.71,282.97
Eleanor Roosevelt National Historic Site,2021,9.73,0.23,6.46,8.09,0.69,35.89,-20.56,1.79,0.0,3.49,316.02
Eugene O'Neill National Historic Site,2021,14.8,2.86,7.66,11.23,0.42,41.92,-0.71,9.59,0.07,1.76,319.95
Everglades National Park,2021,25.85,4.02,20.97,23.4,0.48,31.98,11.69,10.78,0.12,3.17,401.45
Federal Hall National Memorial,2021,12.91,4.04,9.7,11.31,0.73,30.42,-7.27,13.69,0.03,3.8,324.01
Fire Island National Seashore,2021,13.11,4.99,9.98,11.55,0.82,28.87,-7.56,15.78,0.13,3.72,327.82
First Ladies National Historic Site,2021,10.98,1.07,6.37,8.68,0.65,35.78,-15.24,5.25,0.01,2.3,320.0
Flight 93 National Memorial,2021,10.55,0.27,6.3,8.43,0.63,34.9,-17.0,1.79,0.0,2.53,316.79
Florissant Fossil Beds National Monument,2021,7.9,2.59,-3.36,2.26,0.38,34.28,-22.1,15.4,0.03,1.09,266.61
Fort Bowie National Historic Site,2021,16.89,2.49,1.08,8.98,0.31,41.22,-6.62,9.86,0.03,0.95,308.84
Fort Davis National Historic Site,2021,18.15,3.28,3.22,10.69,0.3,41.3,-13.67,11.58,0.09,0.56,321.1
Fort Donelson National Battlefield,2021,15.16,1.26,10.97,13.07,0.78,35.25,-15.75,4.56,0.02,3.72,335.33
