Cape Cod National Seashore,2017,10.76,5.7,7.94,9.36,0.82,25.65,-9.17,20.73,0.05,5.27,321.2
Cape Hatteras National Seashore,2017,18.95,4.88,15.23,17.09,0.75,29.52,-1.81,14.0,0.09,5.27,365.01
Cape Krusenstern National Monument,2017,-3.81,3.66,-5.56,-4.68,0.74,21.46,-37.6,14.33,0.08,0.0,253.73
Cape Lookout National Seashore,2017,19.45,4.1,15.64,17.55,0.78,30.24,-2.27,11.02,0.04,5.27,370.58
Capitol Reef National Park,2017,9.76,2.45,-2.97,3.4,0.37,35.74,-19.53,10.4,0.03,0.0,276.43
Capulin Volcano National Monument,2017,12.26,3.72,0.83,6.55,0.46,36.74,-13.74,13.66,0.06,0.0,298.36
Carl Sandburg Home National Historic Site,2017,13.37,0.36,9.03,11.2,0.72,33.4,-13.94,1.6,0.01,5.27,321.18
Carlsbad Caverns National Park,2017,18.58,3.16,4.16,11.37,0.34,42.01,-7.23,13.95,0.04,0.0,324.67
Carter G. Woodson Home National Historic Site,2017,13.98,2.72,8.78,11.38,0.57,36.41,-11.07,11.07,0.06,0.0,332.33
Casa Grande Ruins National Monument,2017,22.4,2.17,2.31,12.36,0.25,46.48,-2.02,8.96,0.02,0.0,338.62
Castle Clinton National Monument,2017,12.45,4.16,9.15,10.8,0.73,29.09,-8.43,14.41,0.09,5.27,323.12
Catoctin Mountain Park,2017,12.51,1.84,7.73,10.12,0.62,35.71,-12.35,7.45,0.05,0.0,327.17
Cedar Breaks National Monument,2017,9.98,1.76,-2.23,3.87,0.41,35.74,-20.07,8.2,0.01,0.0,273.55
Chaco Culture National Historical Park,2017,11.95,2.71,-1.02,5.47,0.4,36.23,-15.48,10.09,0.05,0.0,289.2
Chamizal National Memorial,2017,18.42,2.8,2.78,10.6,0.29,42.15,-5.81,13.24,0.02,0.0,323.09
Channel Islands National Park,2017,16.19,4.03,12.37,14.28,0.51,30.24,8.62,12.37,0.02,0.0,338.87
Charles Pinckney National Historic Site,2017,19.6,1.3,15.2,17.4,0.66,35.15,-4.4,5.23,0.05,5.27,374.34
Charles Young Buffalo Soldiers National Monument,2017,12.06,2.86,7.83,9.94,0.7,32.43,-16.33,10.49,0.07,5.27,325.45
Chattahoochee River National Recreation Area,2017,16.69,1.06,12.01,14.35,0.67,35.73,-11.06,4.47,0.02,5.27,345.54
Chesapeake and Ohio Canal National Historical Park,2017,13.51,1.96,8.33,10.93,0.6,36.71,-11.79,8.42,0.03,0.0,327.17
Chickamauga and Chattanooga National Military Park,2017,16.27,0.49,11.61,13.94,0.7,37.34,-10.52,1.46,0.02,5.27,342.24
Chickasaw National Recreation Area,2017,17.58,3.19,10.97,14.27,0.49,40.52,-10.33,10.25,0.09,5.27,345.88
Chiricahua National Monument,2017,17.56,2.43,1.9,9.73,0.34,41.84,-5.61,10.33,0.02,0.0,312.56
Christiansted National Historic Site,2017,27.55,5.32,23.33,25.44,0.84,29.91,24.03,20.54,0.09,0.0,411.99
City Of Rocks National Reserve,2017,7.35,2.55,-1.48,2.94,0.55,35.35,-27.27,10.42,0.03,0.0,295.15
Clara Barton National Historic Site,2017,13.98,2.72,8.78,11.38,0.57,36.41,-11.07,11.07,0.06,0.0,332.33
Colonial National Historical Park,2017,15.93,1.19,10.97,13.44,0.69,38.29,-12.68,4.7,0.04,5.27,340.16
Colorado National Monument,2017,10.8,2.34,-1.6,4.59,0.45,37.75,-21.73,10.35,0.03,0.0,280.48
Congaree National Park,2017,18.57,2.21,12.94,15.76,0.48,37.8,-12.68,12.16,0.02,5.27,355.05
Coronado National Memorial,2017,17.89,2.45,2.01,9.94,0.34,41.97,-5.51,10.47,0.01,0.0,306.34
Cowpens National Battlefield,2017,16.49,1.34,11.3,13.9,0.63,36.97,-12.27,6.75,0.02,5.27,335.27
Crater Lake National Park,2017,5.73,0.18,1.2,3.47,0.53,32.5,-21.72,1.34,0.0,0.0,295.49
Craters Of The Moon National Monument and Preserve,2017,8.82,2.57,-0.3,4.26,0.58,37.96,-25.2,10.53,0.04,0.0,276.09
Cumberland Gap National Historical Park,2017,14.35,0.33,9.69,12.02,0.67,35.15,-13.19,1.46,0.01,5.27,331.05
Cumberland Island National Seashore,2017,21.8,3.47,17.95,19.87,0.51,31.62,4.19,17.4,0.06,5.27,376.58
Curecanti National Recreation Area,2017,5.64,0.76,-3.31,1.16,0.5,31.1,-24.49,3.12,0.03,0.0,277.92
Cuyahoga Valley National Park,2017,11.08,4.12,7.33,9.21,0.68,30.29,-10.02,13.55,0.06,0.0,330.67
Dayton Aviation Heritage National Historical Park,2017,11.63,3.12,7.48,9.55,0.71,32.76,-19.48,11.13,0.07,5.27,325.41
De Soto National Memorial,2017,23.56,2.84,19.01,21.29,0.49,34.87,3.37,20.61,0.05,5.27,389.4
Death Valley National Park,2017,19.94,2.16,-0.98,9.48,0.23,45.61,-3.3,10.88,0.01,0.0,293.95
Delaware Water Gap National Recreation Area,2017,10.16,0.23,6.28,8.22,0.59,33.44,-15.04,2.09,0.0,5.27,313.05
Denali National Park and Preserve,2017,-2.09,1.97,-5.13,-3.61,0.79,21.57,-35.76,9.68,0.04,0.0,265.33
Devils Postpile National Monument,2017,7.69,0.5,-1.92,2.88,0.62,32.21,-19.58,1.95,0.01,5.27,286.8
Devils Tower National Monument,2017,8.45,3.24,-0.56,3.95,0.45,38.29,-26.45,11.91,0.03,0.0,290.89
Dinosaur National Monument,2017,9.12,2.62,-2.6,3.26,0.38,36.31,-25.85,11.76,0.02,0.0,283.12
Edgar Allan Poe National Historic Site,2017,12.54,1.96,8.21,10.37,0.6,35.04,-12.61,8.56,0.04,5.27,329.31
Effigy Mounds National Monument,2017,8.58,3.34,4.95,6.76,0.74,32.6,-24.77,11.67,0.12,0.0,308.34
Eisenhower National Historic Site,2017,11.44,1.09,7.02,9.23,0.64,34.37,-12.91,4.83,0.03,5.27,327.17
El Malpais National Monument,2017,11.4,3.18,-2.11,4.64,0.35,35.71,-14.58,11.21,0.06,0.0,290.84
El Morro National Monument,2017,11.4,3.18,-2.11,4.64,0.35,35.71,-14.58,11.21,0.06,0.0,286.23
Eleanor Roosevelt National Historic Site,2017,9.3,0.23,5.62,7.46,0.64,33.73,-17.77,2.12,0.0,5.27,314.23
Eugene O'Neill National Historic Site,2017,14.83,2.65,8.6,11.72,0.58,44.44,-3.16,9.21,0.05,0.0,325.53
Everglades National Park,2017,25.75,4.28,20.73,23.23,0.46,32.49,11.32,31.09,0.12,5.27,404.6
Federal Hall National Memorial,2017,12.45,4.16,9.15,10.8,0.73,29.09,-8.43,14.41,0.09,5.27,323.12
Fire Island National Seashore,2017,12.52,5.14,9.51,11.01,0.84,27.21,-7.66,21.53,0.06,5.27,327.74
First Ladies National Historic Site,2017,10.73,1.15,6.49,8.61,0.7,33.86,-13.81,5.54,0.02,0.0,322.63
Flight 93 National Memorial,2017,10.23,0.3,6.24,8.24,0.64,31.59,-14.84,2.48,0.01,0.0,318.37
Florissant Fossil Beds National Monument,2017,7.9,2.74,-2.5,2.7,0.4,32.63,-17.21,12.68,0.03,0.0,271.63
Fort Bowie National Historic Site,2017,17.56,2.43,1.9,9.73,0.34,41.84,-5.61,10.33,0.02,0.0,312.56
Fort Davis National Historic Site,2017,18.24,3.23,4.52,11.38,0.36,40.3,-7.15,12.06,0.05,0.0,323.69
Fort Donelson National Battlefield,2017,15.76,1.29,10.84,13.3,0.74,37.15,-13.04,5.41,0.02,5.27,340.0
Fort Frederica National Monument,2017,21.8,3.47,17.95,19.87,0.51,31.62,4.19,17.4,0.06,5.27,371.8
Fort Laramie National Historic Site,2017,10.76,3.41,-0.27,5.24,0.37,39.95,-19.53,13.56,0.02,0.0,298.62
Fort Larned National Historic Site,2017,13.98,3.63,5.64,9.81,0.45,41.18,-13.52,11.23,0.05,0.0,323.94
Fort Matanzas National Monument,2017,22.46,1.58,18.2,20.33,0.53,35.82,3.5,9.46,0.05,5.27,379.14
Fort Necessity National Battlefield,2017,10.25,0.42,6.49,8.37,0.7,30.83,-15.12,2.77,0.02,5.27,324.12
Fort Point National Historic Site,2017,14.0,2.28,9.35,11.67,0.65,38.02,-0.52,8.09,0.04,0.0,325.53
Fort Pulaski National Monument,2017,21.26,4.66,17.37,19.32,0.6,31.35,2.91,21.27,0.09,5.27,365.56
Fort Raleigh National Historic Site,2017,17.57,4.41,14.11,15.83,0.73,29.72,-2.72,13.14,0.09,5.27,365.01
Fort Scott National Historic Site,2017,14.01,3.17,9.15,11.58,0.66,38.58,-15.03,11.09,0.07,5.27,333.73
Fort Smith National Historic Site,2017,16.75,1.79,11.21,13.98,0.62,38.44,-9.17,7.0,0.02,5.27,345.75
Fort Stanwix National Monument,2017,8.06,0.46,5.1,6.58,0.78,33.23,-18.92,3.46,0.0,5.27,312.22
Fort Union National Monument,2017,10.63,1.7,-0.76,4.94,0.4,35.8,-14.74,6.42,0.04,0.0,288.91
Fort Union Trading Post National Historic Site,2017,7.22,3.62,-0.77,3.22,0.44,38.9,-31.52,14.12,0.04,0.0,292.95
Fort Vancouver National Historic Site,2017,10.27,0.8,6.48,8.37,0.78,40.12,-10.65,3.52,0.01,5.27,311.68
Fossil Butte National Monument,2017,4.28,1.96,-2.36,0.96,0.54,31.19,-29.95,8.54,0.05,0.0,279.3
Franklin Delano Roosevelt Memorial,2017,13.98,2.72,8.78,11.38,0.57,36.41,-11.07,11.07,0.06,0.0,332.33
Frederick Douglass National Historic Site,2017,13.98,2.72,8.78,11.38,0.57,36.41,-11.07,11.07,0.06,0.0,334.77
Frederick Law Olmsted National Historic Site,2017,9.73,0.68,6.05,7.88,0.65,31.86,-19.88,3.19,0.01,5.27,309.92
Friendship Hill National Historic Site,2017,11.33,0.23,7.23,9.28,0.69,32.64,-14.24,2.01,0.0,5.27,324.12
Gates Of The Arctic National Park and Preserve,2017,-8.49,1.91,-9.91,-9.2,0.88,19.32,-42.47,9.95,0.02,0.0,238.91
Gateway National Recreation Area,2017,12.45,4.16,9.15,10.8,0.73,29.09,-8.43,14.41,0.09,5.27,327.74
Gauley River National Recreation Area,2017,12.58,0.18,7.69,10.13,0.6,35.33,-14.31,1.42,0.0,0.0,334.16
General Grant National Memorial,2017,11.27,1.59,7.49,9.38,0.6,32.89,-13.92,6.29,0.02,5.27,327.74
George Rogers Clark National Historical Park,2017,14.0,2.9,8.98,11.49,0.66,36.62,-16.74,11.93,0.05,0.0,333.98
George Washington Birthplace National Monument,2017,15.12,0.77,9.94,12.53,0.66,37.67,-10.79,3.14,0.02,0.0,334.77
George Washington Carver National Monument,2017,14.88,2.96,9.68,12.28,0.7,38.57,-15.99,10.17,0.02,5.27,337.25
Gettysburg National Military Park,2017,11.44,1.09,7.02,9.23,0.64,34.37,-12.91,4.83,0.03,5.27,327.17
Gila Cliff Dwellings National Monument,2017,12.63,1.02,0.29,6.46,0.48,37.77,-9.35,4.07,0.02,0.0,282.41
Glacier National Park,2017,1.55,0.42,-2.27,-0.36,0.69,31.1,-31.85,1.61,0.0,5.27,278.27
Glacier Bay National Park and Preserve,2017,-2.56,2.02,-4.18,-3.37,0.74,15.01,-28.23,12.23,0.04,10.55,282.38
Glen Canyon National Recreation Area,2017,14.33,2.28,-1.11,6.61,0.3,40.83,-8.8,10.05,0.02,0.0,294.32
Golden Gate National Recreation Area,2017,14.0,2.28,9.35,11.67,0.65,38.02,-0.52,8.09,0.04,0.0,325.53
Governors Island National Monument,2017,12.45,4.16,9.15,10.8,0.73,29.09,-8.43,14.41,0.09,5.27,323.12
Grand Canyon National Park,2017,12.65,2.42,-1.06,5.79,0.39,38.29,-13.38,10.74,0.05,0.0,292.22
Grand Portage National Monument,2017,3.53,2.05,0.7,2.12,0.58,27.65,-27.52,7.23,0.02,0.0,312.54
Grand Teton National Park,2017,0.72,0.65,-3.27,-1.27,0.66,27.26,-33.16,2.38,0.01,0.0,264.95
Grant-Kohrs Ranch National Historic Site,2017,4.06,1.23,-1.58,1.24,0.55,32.73,-28.17,4.52,0.03,0.0,279.42
Great Basin National Park,2017,9.35,2.47,-3.02,3.16,0.38,35.44,-18.69,13.85,0.05,0.0,281.91
Great Sand Dunes National Park and Preserve,2017,7.01,2.52,-2.56,2.23,0.45,32.12,-24.2,11.1,0.04,0.0,273.92
Great Smoky Mountains National Park,2017,13.55,0.42,9.21,11.38,0.75,32.42,-14.01,1.64,0.01,5.27,324.3
Greenbelt Park,2017,13.98,2.72,8.78,11.38,0.57,36.41,-11.07,11.07,0.06,0.0,334.77
Guadalupe Mountains National Park,2017,17.46,2.98,3.39,10.43,0.34,40.68,-7.29,13.95,0.04,0.0,324.43
Guilford Courthouse National Military Park,2017,15.6,1.98,10.32,12.96,0.62,36.55,-10.78,7.49,0.01,5.27,337.37
Hagerman Fossil Beds National Monument,2017,10.27,2.45,0.3,5.28,0.52,39.37,-25.62,9.04,0.03,0.0,299.9
Hamilton Grange National Memorial,2017,11.27,1.59,7.49,9.38,0.6,32.89,-13.92,6.29,0.02,5.27,327.74
Hampton National Historic Site,2017,12.82,2.65,8.02,10.42,0.6,35.73,-12.35,10.13,0.02,0.0,326.31
Harpers Ferry National Historical Park,2017,12.51,1.84,7.73,10.12,0.62,35.71,-12.35,7.45,0.05,0.0,327.17
Harry S Truman National Historic Site,2017,13.46,3.12,8.13,10.8,0.61,40.01,-16.26,10.91,0.06,5.27,329.83
Herbert Hoover National Historic Site,2017,11.19,3.27,5.67,8.43,0.61,35.12,-19.72,10.91,0.09,0.0,318.35
Home Of Franklin D Roosevelt National Historic Site,2017,9.3,0.23,5.62,7.46,0.64,33.73,-17.77,2.12,0.0,5.27,314.23
Hopewell Culture National Historical Park,2017,12.32,2.23,7.82,10.07,0.67,33.15,-14.97,8.46,0.05,0.0,325.45
Hopewell Furnace National Historic Site,2017,12.38,0.62,7.8,10.09,0.62,35.33,-12.81,3.19,0.01,5.27,320.69
Horseshoe Bend National Military Park,2017,17.58,0.12,13.21,15.4,0.7,37.65,-13.99,1.16,0.0,5.27,354.5
Hot Springs National Park,2017,17.27,0.21,12.05,14.66,0.65,39.27,-8.17,1.27,0.0,5.27,347.68
Hovenweep National Monument,2017,10.55,1.3,-1.57,4.48,0.4,36.05,-19.66,4.39,0.03,0.0,293.75
Hubbell Trading Post National Historic Site,2017,12.32,2.84,-2.02,5.15,0.34,37.65,-13.73,10.14,0.05,0.0,289.0
Independence National Historical Park,2017,12.54,1.96,8.21,10.37,0.6,35.04,-12.61,8.56,0.04,5.27,329.31
Isle Royale National Park,2017,4.37,4.37,2.15,3.26,0.64,19.97,-17.06,14.76,0.05,0.0,292.2
James A Garfield National Historic Site,2017,10.51,1.03,6.48,8.5,0.7,32.92,-12.8,4.7,0.02,0.0,330.67
Jewel Cave National Monument,2017,9.28,2.77,-0.3,4.49,0.38,38.62,-23.05,10.96,0.05,0.0,297.69
John Day Fossil Beds National Monument,2017,7.9,2.35,0.94,4.42,0.51,37.05,-22.26,10.3,0.03,0.0,289.18
John Muir National Historic Site,2017,14.83,2.65,8.6,11.72,0.58,44.44,-3.16,9.21,0.05,0.0,325.53
Johnstown Flood National Memorial,2017,9.8,0.28,5.94,7.87,0.64,31.59,-15.85,2.43,0.0,0.0,318.37
Joshua Tree National Park,2017,21.92,2.38,1.69,11.8,0.2,47.13,-0.81,9.48,0.02,0.0,339.79
Kalaupapa National Historical Park,2017,25.13,4.8,19.91,22.52,0.33,30.05,19.9,11.73,0.05,0.0,394.28
Katmai National Park and Preserve,2017,-0.45,2.91,-2.37,-1.42,0.88,21.81,-33.42,14.92,0.02,5.27,273.48
Kenai Fjords National Park,2017,-3.02,2.66,-4.07,-3.55,0.84,16.0,-29.38,16.41,0.05,10.55,278.22
Kennesaw Mountain National Battlefield Park,2017,16.69,1.06,12.01,14.35,0.67,35.73,-11.06,4.47,0.02,5.27,345.54
Keweenaw National Historical Park,2017,5.32,2.59,2.83,4.08,0.64,26.94,-16.79,8.91,0.04,5.27,312.54
Kings Mountain National Military Park,2017,16.89,1.0,11.41,14.15,0.6,37.72,-12.2,4.6,0.02,5.27,335.27
Knife River Indian Villages National Historic Site,2017,6.65,3.75,-0.56,3.05,0.43,39.26,-31.85,15.09,0.06,0.0,294.39
Kobuk Valley National Park,2017,-5.92,2.93,-7.4,-6.66,0.84,23.12,-41.49,12.49,0.04,0.0,247.77
Korean War Veterans Memorial,2017,13.98,2.72,8.78,11.38,0.57,36.41,-11.07,11.07,0.06,0.0,332.33
Lake Clark National Park and Preserve,2017,-3.21,2.08,-5.33,-4.27,0.8,19.97,-36.32,14.15,0.04,5.27,259.61
Lake Mead National Recreation Area,2017,20.48,2.43,1.72,11.1,0.29,46.03,-3.52,12.32,0.02,0.0,316.52
Lake Meredith National Recreation Area,2017,15.7,3.62,4.64,10.17,0.38,42.74,-11.39,12.2,0.09,0.0,323.47
Lake Roosevelt National Recreation Area,2017,7.18,0.67,1.26,4.22,0.48,35.37,-25.14,2.61,0.02,0.0,285.58
Lassen Volcanic National Park,2017,8.39,0.36,-0.27,4.05,0.65,36.99,-17.38,1.6,0.01,5.27,288.37
Lava Beds National Monument,2017,8.81,2.34,1.13,4.98,0.54,36.75,-23.31,8.78,0.05,0.0,283.16
Lewis and Clark National Historical Park,2017,9.7,1.44,7.66,8.68,0.82,26.65,-5.16,4.65,0.02,5.27,309.86
Lincoln Memorial,2017,13.98,2.72,8.78,11.38,0.57,36.41,-11.07,11.07,0.06,0.0,332.33
Lincoln Boyhood National Memorial,2017,14.22,1.7,9.55,11.88,0.7,36.45,-13.7,6.98,0.03,5.27,332.73
Lincoln Home National Historic Site,2017,12.78,3.21,7.08,9.93,0.62,36.35,-18.77,11.53,0.06,0.0,325.56
Little Bighorn Battlefield National Monument,2017,9.87,2.77,-0.18,4.84,0.46,39.34,-25.18,11.09,0.03,0.0,301.3
Little River Canyon National Preserve,2017,16.3,0.34,11.87,14.08,0.7,36.59,-11.27,1.24,0.01,5.27,342.24
Little Rock Central High School National Historic Site,2017,17.7,0.41,12.19,14.94,0.65,40.05,-7.58,1.55,0.02,5.27,352.42
Lowell National Historical Park,2017,9.73,0.68,6.05,7.88,0.65,31.86,-19.88,3.19,0.01,5.27,309.92
Lyndon B Johnson National Historical Park,2017,20.06,3.15,12.21,16.13,0.55,41.05,-7.67,10.59,0.05,0.0,359.55
Maggie L Walker National Historic Site,2017,15.33,0.87,9.84,12.59,0.63,38.71,-12.05,3.78,0.01,0.0,337.56
Mammoth Cave National Park,2017,14.57,1.78,10.58,12.58,0.77,34.26,-13.61,7.57,0.01,5.27,336.55
Manassas National Battlefield Park,2017,13.51,1.96,8.33,10.93,0.6,36.71,-11.79,8.42,0.03,0.0,332.33
Manzanar National Historic Site,2017,9.06,2.11,-3.2,2.93,0.54,32.37,-17.81,10.93,0.02,0.0,267.89
Marsh - Billings - Rockefeller National Historical Park,2017,6.71,0.25,3.69,5.2,0.54,29.06,-26.16,1.98,0.0,5.27,303.03
Martin Van Buren National Historic Site,2017,8.45,0.27,5.15,6.8,0.69,32.41,-21.59,2.34,0.0,5.27,310.12
Mary McLeod Bethune Council House National Historic Site,2017,13.98,2.72,8.78,11.38,0.57,36.41,-11.07,11.07,0.06,0.0,332.33
Mesa Verde National Park,2017,12.36,2.33,-0.6,5.88,0.42,37.9,-16.68,8.73,0.03,0.0,275.27
Minute Man National Historical Park,2017,9.73,0.68,6.05,7.88,0.65,31.86,-19.88,3.19,0.01,5.27,309.92
Minuteman Missile National Historic Site,2017,10.59,3.51,0.94,5.76,0.47,41.98,-24.24,13.18,0.02,0.0,306.99
Mojave National Preserve,2017,18.48,2.62,0.17,9.32,0.26,43.7,-3.77,12.68,0.02,0.0,312.41
Monocacy National Battlefield,2017,12.51,1.84,7.73,10.12,0.62,35.71,-12.35,7.45,0.05,0.0,327.17
Montezuma Castle National Monument,2017,16.98,2.15,1.35,9.16,0.44,43.27,-6.33,7.84,0.03,0.0,296.22
Moores Creek National Battlefield,2017,17.83,0.2,13.78,15.8,0.78,36.65,-10.86,1.23,0.0,5.27,351.39
Morristown National Historical Park,2017,10.62,0.46,6.7,8.65,0.62,33.55,-14.24,2.59,0.01,5.27,323.12
Mount Rainier National Park,2017,6.18,0.2,3.02,4.6,0.71,31.76,-14.94,1.51,0.0,5.27,283.68
Mount Rushmore National Memorial,2017,6.88,0.89,-1.48,2.7,0.4,35.55,-22.97,4.02,0.02,0.0,297.69
Muir Woods National Monument,2017,14.0,2.28,9.35,11.67,0.65,38.02,-0.52,8.09,0.04,0.0,325.53
Natchez National Historical Park,2017,19.57,0.78,15.24,17.4,0.7,37.91,-8.2,2.55,0.02,5.27,365.95
Natchez Trace Parkway,2017,17.89,2.06,13.05,15.47,0.76,37.95,-8.63,8.34,0.02,5.27,355.35
Natural Bridges National Monument,2017,13.02,2.52,-1.94,5.55,0.27,39.08,-11.99,9.73,0.07,0.0,306.64
Navajo National Monument,2017,12.05,3.07,-2.32,4.87,0.3,37.12,-13.41,11.43,0.05,0.0,285.81
New Bedford Whaling National Historical Park,2017,11.15,5.34,8.12,9.64,0.63,27.31,-10.61,20.34,0.15,5.27,321.2
New Orleans Jazz National Historical Park,2017,21.58,3.22,17.9,19.74,0.75,32.9,-2.35,10.05,0.05,5.27,381.37
Nez Perce National Historical Park,2017,5.89,0.29,0.96,3.42,0.57,34.46,-27.61,1.7,0.0,5.27,286.96
Nicodemus National Historic Site,2017,13.15,3.4,4.74,8.94,0.41,42.0,-15.65,11.16,0.05,0.0,321.35
Ninety Six National Historic Site,2017,18.06,0.42,12.56,15.31,0.57,37.96,-10.88,2.16,0.02,5.27,342.55
Niobrara National Scenic River,2017,10.17,3.63,2.09,6.13,0.45,42.23,-23.03,12.08,0.05,0.0,308.82
Noatak National Preserve,2017,-6.43,2.99,-8.13,-7.28,0.68,23.46,-40.21,12.61,0.12,0.0,245.46
North Cascades National Park,2017,3.12,0.26,0.31,1.72,0.66,29.8,-26.38,1.7,0.0,5.27,279.84
Olympic National Park,2017,6.87,0.62,4.29,5.58,0.72,33.9,-12.81,1.94,0.01,5.27,304.42
Organ Pipe Cactus National Monument,2017,23.36,2.63,4.82,14.09,0.23,46.45,0.39,9.73,0.04,0.0,334.93
Padre Island National Seashore,2017,24.36,4.02,19.1,21.73,0.33,37.68,0.17,11.79,0.06,0.0,387.77
Palo Alto Battlefield National Historical Park,2017,25.2,3.7,18.65,21.93,0.37,39.39,0.12,10.65,0.04,0.0,394.17
Paterson Great Falls National Historical Park,2017,10.62,0.46,6.7,8.65,0.62,33.55,-14.24,2.59,0.01,5.27,323.12
Pea Ridge National Military Park,2017,15.14,1.3,9.51,12.33,0.68,38.83,-13.85,4.61,0.05,5.27,337.25
Pecos National Historical Park,2017,11.26,2.88,-0.43,5.42,0.45,36.37,-13.6,10.62,0.07,0.0,288.91
Perry's Victory and International Peace Memorial,2017,11.17,4.2,7.37,9.26,0.7,29.64,-11.42,14.23,0.12,0.0,333.06
Petersburg National Battlefield,2017,15.69,0.09,10.31,13.0,0.64,38.98,-13.17,1.18,0.0,5.27,337.56
Petrified Forest National Park,2017,14.44,2.51,-1.17,6.63,0.27,39.72,-10.5,10.04,0.05,0.0,297.44
Petroglyph National Monument,2017,14.71,2.24,0.01,7.36,0.34,40.14,-7.56,10.42,0.02,0.0,294.57
Pictured Rocks National Lakeshore,2017,5.3,2.59,3.02,4.16,0.62,26.56,-18.24,9.66,0.08,5.27,308.45
Pinnacles National Park,2017,15.73,2.06,6.08,10.9,0.48,43.82,-1.41,9.87,0.02,0.0,309.98
Pipe Spring National Monument,2017,12.17,2.45,-1.48,5.34,0.37,37.98,-15.63,10.6,0.02,0.0,292.22
Pipestone National Monument,2017,8.08,3.66,2.74,5.41,0.51,35.22,-26.69,11.56,0.05,0.0,302.76
Point Reyes National Seashore,2017,13.19,4.12,10.46,11.83,0.8,27.43,4.34,12.34,0.09,0.0,312.63
Port Chicago Naval Magazine National Memorial,2017,14.83,2.65,8.6,11.72,0.58,44.44,-3.16,9.21,0.05,0.0,312.63
President William Jefferson Clinton Birthplace Home National Historic Site,2017,18.66,0.73,13.23,15.94,0.61,39.07,-7.08,2.63,0.02,5.27,359.72
Prince William Forest Park,2017,14.19,0.8,8.81,11.5,0.62,37.23,-12.06,3.89,0.01,0.0,332.33
Rainbow Bridge National Monument,2017,14.33,2.28,-1.11,6.61,0.3,40.83,-8.8,10.05,0.02,0.0,294.32
Richmond National Battlefield Park,2017,15.33,0.87,9.84,12.59,0.63,38.71,-12.05,3.78,0.01,0.0,337.56
Rock Creek Park,2017,13.98,2.72,8.78,11.38,0.57,36.41,-11.07,11.07,0.06,0.0,332.33
Rocky Mountain National Park,2017,4.16,1.37,-3.36,0.4,0.44,29.47,-32.19,5.44,0.02,0.0,276.45
Rosie the Riveter WWII Home Front National Historical Park,2017,14.0,2.28,9.35,11.67,0.65,38.02,-0.52,8.09,0.04,0.0,325.53
Russell Cave National Monument,2017,15.48,0.35,11.19,13.33,0.7,35.22,-13.28,1.21,0.01,5.27,342.24
Sagamore Hill National Historic Site,2017,11.27,1.59,7.49,9.38,0.6,32.89,-13.92,6.29,0.02,5.27,327.74
Saguaro National Park,2017,19.08,2.28,1.82,10.44,0.3,43.24,-4.61,9.84,0.03,0.0,315.34
Saint Croix Island International Historic Site,2017,6.74,2.2,4.39,5.57,0.72,25.16,-19.81,7.77,0.05,5.27,300.52
Saint Paul's Church National Historic Site,2017,11.27,1.59,7.49,9.38,0.6,32.89,-13.92,6.29,0.02,5.27,327.74
Salem Maritime National Historic Site,2017,10.27,3.14,7.13,8.7,0.82,26.76,-12.88,11.45,0.06,5.27,317.45
Salinas Pueblo Missions National Monument,2017,13.15,2.89,-0.06,6.55,0.36,37.56,-9.87,11.45,0.07,0.0,300.82
Salt River Bay National Historical Park and Ecological Preserve,2017,27.48,5.27,23.11,25.29,0.56,30.08,23.42,21.41,0.11,0.0,411.99
San Antonio Missions National Historical Park,2017,21.31,2.75,14.83,18.07,0.62,41.87,-6.74,12.39,0.09,5.27,369.16
San Francisco Maritime National Historical Park,2017,14.0,2.28,9.35,11.67,0.65,38.02,-0.52,8.09,0.04,0.0,325.53
San Juan National Historic Site,2017,26.65,3.8,22.69,24.66,0.75,31.83,21.3,19.38,0.09,5.27,414.93
San Juan Island National Historical Park,2017,10.33,2.41,7.04,8.69,0.61,28.14,-4.51,8.12,0.03,5.27,312.12
Sand Creek Massacre National Historic Site,2017,12.87,3.16,2.55,7.71,0.38,39.38,-13.47,13.4,0.02,0.0,309.12
Santa Monica Mountains National Recreation Area,2017,18.02,2.39,10.25,14.14,0.46,35.48,5.33,12.04,0.02,0.0,308.05
Saratoga National Historical Park,2017,8.48,0.29,5.15,6.82,0.63,31.39,-29.33,2.07,0.0,5.27,310.12
Saugus Iron Works National Historic Site,2017,9.73,0.68,6.05,7.88,0.65,31.86,-19.88,3.19,0.01,5.27,309.92
Scotts Bluff National Monument,2017,10.48,3.3,0.13,5.3,0.38,40.38,-20.18,12.61,0.05,0.0,299.0
Shenandoah National Park,2017,12.27,1.2,6.97,9.62,0.58,35.38,-13.78,5.6,0.01,0.0,327.65
Shiloh National Military Park,2017,16.88,0.52,11.94,14.41,0.68,39.05,-11.23,1.92,0.01,5.27,343.05
Sitka National Historical Park,2017,6.94,4.2,4.36,5.65,0.81,18.74,-7.85,14.89,0.01,5.27,294.63
Sleeping Bear Dunes National Lakeshore,2017,8.05,5.32,5.36,6.71,0.62,22.48,-11.28,15.3,0.03,0.0,324.77
Springfield Armory National Historic Site,2017,9.65,0.17,5.75,7.7,0.53,34.11,-20.04,1.36,0.0,5.27,308.44
Steamtown National Historic Site,2017,8.55,0.27,5.21,6.88,0.66,31.93,-17.01,2.3,0.0,5.27,311.48
Stones River National Battlefield,2017,15.44,1.69,11.26,13.35,0.76,34.76,-13.17,6.77,0.01,5.27,339.21
Stonewall National Monument,2017,12.45,4.16,9.15,10.8,0.73,29.09,-8.43,14.41,0.09,5.27,323.12
Sunset Crater Volcano National Monument,2017,14.64,2.59,-0.13,7.26,0.37,39.44,-9.43,10.61,0.02,0.0,288.52
Tallgrass Prairie National Preserve,2017,14.04,3.55,7.19,10.62,0.46,42.35,-15.22,11.2,0.03,0.0,328.53
Thaddeus Kosciuszko National Memorial,2017,12.54,1.96,8.21,10.37,0.6,35.04,-12.61,8.56,0.04,5.27,329.31
Theodore Roosevelt National Park,2017,7.48,3.91,-0.63,3.43,0.48,40.73,-29.64,14.15,0.05,0.0,294.8
Theodore Roosevelt Birthplace National Historic Site,2017,12.45,4.16,9.15,10.8,0.73,29.09,-8.43,14.41,0.09,5.27,327.74
Theodore Roosevelt Inaugural National Historic Site,2017,9.61,1.94,5.85,7.73,0.71,32.26,-14.81,7.62,0.02,5.27,315.58
Thomas Edison National Historical Park,2017,10.62,0.46,6.7,8.65,0.62,33.55,-14.24,2.59,0.01,5.27,323.12
Thomas Stone National Historic Site,2017,14.68,1.27,9.43,12.05,0.61,36.36,-10.64,5.61,0.02,0.0,332.33
Timpanogos Cave National Monument,2017,9.76,1.92,0.18,4.97,0.57,35.87,-23.77,9.9,0.03,0.0,282.01
Tonto National Monument,2017,20.85,2.09,2.25,11.55,0.32,45.49,-3.3,8.48,0.03,0.0,334.68
Tuskegee Airmen National Historic Site,2017,18.26,0.42,14.05,16.16,0.7,37.0,-15.55,2.0,0.01,5.27,354.5
Tuskegee Institute National Historic Site,2017,18.26,0.42,14.05,16.16,0.7,37.0,-15.55,2.0,0.01,5.27,354.5
Tuzigoot National Monument,2017,12.72,0.68,-0.17,6.27,0.48,39.52,-18.9,2.11,0.01,0.0,298.73
Ulysses S Grant National Historic Site,2017,14.23,1.16,8.29,11.26,0.6,40.12,-17.63,4.9,0.04,0.0,331.5
Valley Forge National Historical Park,2017,12.38,0.62,7.8,10.09,0.62,35.33,-12.81,3.19,0.01,5.27,320.69
Vanderbilt Mansion National Historic Site,2017,9.3,0.23,5.62,7.46,0.64,33.73,-17.77,2.12,0.0,5.27,314.23
Vicksburg National Military Park,2017,19.03,1.91,14.4,16.72,0.69,35.76,-9.52,6.77,0.05,5.27,360.61
Vietnam Veterans Memorial,2017,13.98,2.72,8.78,11.38,0.57,36.41,-11.07,11.07,0.06,0.0,332.33
Virgin Islands National Park,2017,27.33,5.38,23.11,25.23,0.63,29.93,23.37,23.21,0.21,0.0,411.88
Voyageurs National Park,2017,3.84,1.08,-0.21,1.82,0.49,31.82,-37.36,4.57,0.04,0.0,290.52
Waco Mammoth National Monument,2017,20.38,2.88,13.77,17.08,0.59,40.72,-7.77,9.5,0.01,0.0,359.66
Walnut Canyon National Monument,2017,12.23,2.44,-0.38,5.92,0.43,36.98,-16.02,9.16,0.02,0.0,288.52
War In The Pacific National Historical Park,2017,28.47,4.88,24.64,26.55,0.67,30.35,26.32,12.73,0.16,5.27,423.85
Washita Battlefield National Historic Site,2017,16.01,3.61,6.77,11.4,0.44,40.96,-11.64,11.8,0.05,0.0,332.28
Whiskeytown National Recreation Area,2017,15.72,0.82,4.44,10.08,0.6,45.82,-10.12,3.15,0.01,5.27,314.11
Whitman Mission National Historic Site,2017,11.65,2.43,3.49,7.58,0.46,39.22,-15.65,9.01,0.02,0.0,311.48
William Howard Taft National Historic Site,2017,12.98,0.5,8.39,10.69,0.7,34.65,-14.49,2.53,0.02,5.27,325.41
Wilson's Creek National Battlefield,2017,14.55,1.66,9.21,11.88,0.65,38.63,-15.12,5.98,0.06,5.27,334.41
Wind Cave National Park,2017,9.28,2.77,-0.3,4.49,0.38,38.62,-23.05,10.96,0.05,0.0,297.69
