Lassen Volcanic National Park,2014,9.24,0.36,-0.7,4.27,0.55,35.67,-11.26,1.3,0.01,0.0,286.53
Lava Beds National Monument,2014,10.05,2.25,0.62,5.33,0.43,36.05,-12.65,9.58,0.05,0.0,283.13
Lewis and Clark National Historical Park,2014,10.67,1.44,8.51,9.58,0.8,28.96,-6.31,4.37,0.05,5.27,314.45
Lincoln Memorial,2014,11.85,2.64,7.65,9.75,0.68,33.17,-16.49,10.7,0.06,5.27,323.56
Lincoln Boyhood National Memorial,2014,11.76,1.68,7.84,9.8,0.74,32.9,-23.07,6.66,0.05,5.27,321.79
Lincoln Home National Historic Site,2014,9.77,3.2,5.72,7.74,0.7,34.83,-27.02,12.73,0.05,5.27,317.63
Little Bighorn Battlefield National Monument,2014,8.77,2.98,0.49,4.63,0.51,38.43,-23.82,12.93,0.07,0.0,300.34
Little River Canyon National Preserve,2014,14.71,0.33,10.19,12.44,0.72,37.39,-15.04,1.19,0.01,5.27,334.91
Little Rock Central High School National Historic Site,2014,15.38,0.42,10.65,13.01,0.71,40.19,-13.02,1.41,0.0,5.27,340.18
Lowell National Historical Park,2014,8.95,0.66,5.18,7.06,0.63,31.94,-23.47,2.66,0.01,5.27,305.55
Lyndon B Johnson National Historical Park,2014,18.61,3.27,10.6,14.6,0.53,39.37,-7.43,8.85,0.09,0.0,354.59
Maggie L Walker National Historic Site,2014,13.46,0.85,8.73,11.09,0.7,36.59,-13.45,3.54,0.02,5.27,330.16
Mammoth Cave National Park,2014,12.71,1.78,8.64,10.67,0.75,35.08,-18.7,7.05,0.02,5.27,327.4
Manassas National Battlefield Park,2014,11.36,1.91,7.07,9.21,0.7,34.67,-19.06,9.2,0.05,5.27,323.56
Manzanar National Historic Site,2014,9.88,1.97,-4.84,2.52,0.35,32.89,-13.45,9.08,0.05,0.0,263.59
Marsh - Billings - Rockefeller National Historical Park,2014,5.55,0.24,2.94,4.24,0.62,29.05,-30.25,1.93,0.0,5.27,297.57
Martin Van Buren National Historic Site,2014,7.24,0.26,3.89,5.56,0.68,31.76,-26.74,1.98,0.0,5.27,304.37
Mary McLeod Bethune Council House National Historic Site,2014,11.85,2.64,7.65,9.75,0.68,33.17,-16.49,10.7,0.06,5.27,323.56
Mesa Verde National Park,2014,11.79,2.47,-1.36,5.21,0.41,37.73,-10.83,12.47,0.02,0.0,273.42
Minute Man National Historical Park,2014,8.95,0.66,5.18,7.06,0.63,31.94,-23.47,2.66,0.01,5.27,305.55
Minuteman Missile National Historic Site,2014,8.93,3.64,1.34,5.13,0.54,40.57,-23.27,14.23,0.03,0.0,303.8
Mojave National Preserve,2014,18.54,2.53,-0.88,8.83,0.23,41.69,-3.35,9.74,0.02,0.0,310.62
Monocacy National Battlefield,2014,10.43,1.79,6.3,8.37,0.69,34.02,-23.22,8.29,0.02,5.27,318.77
Montezuma Castle National Monument,2014,16.53,2.1,0.83,8.68,0.43,37.91,-5.02,8.12,0.02,0.0,292.48
Moores Creek National Battlefield,2014,16.42,0.2,12.25,14.33,0.73,37.58,-9.14,1.14,0.0,5.27,344.45
Morristown National Historical Park,2014,9.28,0.45,5.19,7.24,0.62,33.98,-24.52,2.42,0.01,5.27,316.16
Mount Rainier National Park,2014,6.94,0.19,3.87,5.41,0.72,32.58,-17.48,1.37,0.0,5.27,286.1
Mount Rushmore National Memorial,2014,5.54,0.95,-0.93,2.3,0.48,37.35,-27.22,3.95,0.01,0.0,294.32
Muir Woods National Monument,2014,14.84,2.12,9.83,12.34,0.48,33.19,3.15,7.65,0.05,0.0,331.91
Natchez National Historical Park,2014,17.67,0.77,13.33,15.5,0.72,36.28,-6.98,2.77,0.02,5.27,356.55
Natchez Trace Parkway,2014,15.74,2.0,11.53,13.64,0.81,38.44,-13.92,7.97,0.05,5.27,344.22
Natural Bridges National Monument,2014,12.37,2.43,-2.14,5.12,0.32,37.76,-10.1,12.49,0.07,0.0,304.78
Navajo National Monument,2014,11.54,2.93,-2.82,4.36,0.3,35.64,-10.74,14.23,0.03,0.0,283.26
New Bedford Whaling National Historical Park,2014,10.69,5.17,7.4,9.05,0.58,25.96,-12.39,15.91,0.05,5.27,317.95
New Orleans Jazz National Historical Park,2014,20.23,3.05,16.14,18.19,0.7,33.24,-3.18,9.38,0.03,5.27,372.67
Nez Perce National Historical Park,2014,6.42,0.27,1.21,3.82,0.54,34.39,-28.17,1.33,0.0,5.27,286.49
Nicodemus National Historic Site,2014,12.22,3.59,3.22,7.72,0.39,41.68,-19.83,11.66,0.03,0.0,317.3
Ninety Six National Historic Site,2014,16.3,0.42,11.19,13.74,0.62,38.67,-9.58,1.46,0.01,5.27,334.76
Niobrara National Scenic River,2014,8.76,3.89,1.26,5.01,0.44,41.82,-23.93,14.22,0.05,0.0,304.03
Noatak National Preserve,2014,-7.1,3.16,-8.7,-7.9,0.79,21.01,-39.98,13.33,0.02,0.0,245.38
North Cascades National Park,2014,3.63,0.23,1.2,2.41,0.71,32.15,-26.12,1.62,0.0,5.27,283.75
Olympic National Park,2014,7.87,0.6,5.11,6.48,0.7,30.62,-11.77,1.91,0.02,5.27,309.16
Organ Pipe Cactus National Monument,2014,23.13,2.63,5.27,14.2,0.26,43.48,-0.26,8.21,0.03,0.0,333.63
Padre Island National Seashore,2014,22.75,4.16,18.27,20.51,0.38,36.28,2.9,10.69,0.04,0.0,383.44
Palo Alto Battlefield National Historical Park,2014,23.38,3.73,18.03,20.71,0.43,40.18,1.08,9.84,0.02,0.0,390.37
Pea Ridge National Military Park,2014,13.09,1.34,7.85,10.48,0.71,38.66,-18.86,5.92,0.05,0.0,327.8
Pecos National Historical Park,2014,10.25,2.91,-1.18,4.53,0.45,35.57,-15.88,10.44,0.06,0.0,286.38
Perry's Victory and International Peace Memorial,2014,9.06,4.15,5.19,7.12,0.7,28.96,-23.02,13.64,0.04,0.0,325.55
Petersburg National Battlefield,2014,13.89,0.09,9.26,11.57,0.71,36.9,-12.71,1.17,0.0,5.27,330.16
Petrified Forest National Park,2014,13.56,2.48,-1.2,6.18,0.31,37.27,-6.8,11.5,0.02,0.0,291.84
Petroglyph National Monument,2014,13.8,2.37,-0.6,6.6,0.34,38.76,-9.4,10.42,0.02,0.0,290.34
Pictured Rocks National Lakeshore,2014,2.63,2.45,0.8,1.71,0.61,25.21,-27.13,8.7,0.04,5.27,302.23
Pinnacles National Park,2014,16.44,1.99,6.11,11.27,0.38,41.27,-3.51,9.55,0.02,0.0,311.59
Pipe Spring National Monument,2014,11.8,2.29,-2.29,4.76,0.35,36.3,-10.98,10.68,0.02,0.0,288.17
Pipestone National Monument,2014,6.19,3.93,0.87,3.53,0.46,30.6,-31.27,11.52,0.06,0.0,295.45
Point Reyes National Seashore,2014,14.01,3.7,11.28,12.65,0.71,24.75,6.87,11.95,0.02,0.0,315.38
Port Chicago Naval Magazine National Memorial,2014,16.11,2.59,8.58,12.34,0.38,40.98,-1.22,7.79,0.03,0.0,315.38
President William Jefferson Clinton Birthplace Home National Historic Site,2014,16.61,0.73,11.52,14.07,0.63,40.05,-8.7,2.23,0.02,5.27,348.68
Prince William Forest Park,2014,12.14,0.79,7.65,9.9,0.72,35.41,-16.26,3.56,0.02,5.27,323.56
Rainbow Bridge National Monument,2014,14.02,2.22,-1.82,6.1,0.3,38.85,-10.11,12.58,0.06,0.0,292.41
Richmond National Battlefield Park,2014,13.46,0.85,8.73,11.09,0.7,36.59,-13.45,3.54,0.02,5.27,330.16
Rock Creek Park,2014,11.85,2.64,7.65,9.75,0.68,33.17,-16.49,10.7,0.06,5.27,323.56
Rocky Mountain National Park,2014,3.12,1.45,-3.54,-0.2,0.48,29.5,-28.62,5.3,0.02,0.0,272.77
Rosie the Riveter WWII Home Front National Historical Park,2014,14.84,2.12,9.83,12.34,0.48,33.19,3.15,7.65,0.05,0.0,331.91
Russell Cave National Monument,2014,13.86,0.34,9.51,11.69,0.7,36.47,-15.81,1.29,0.02,5.27,334.91
Sagamore Hill National Historic Site,2014,10.08,1.58,6.05,8.06,0.59,33.11,-21.13,5.33,0.05,5.27,320.2
Saguaro National Park,2014,18.25,2.23,2.1,10.17,0.34,40.09,-3.78,9.95,0.03,0.0,314.24
Saint Croix Island International Historic Site,2014,6.48,2.19,4.2,5.34,0.79,25.9,-22.44,7.54,0.02,5.27,297.91
Saint Paul's Church National Historic Site,2014,10.08,1.58,6.05,8.06,0.59,33.11,-21.13,5.33,0.05,5.27,320.2
Salem Maritime National Historic Site,2014,9.69,3.06,6.46,8.07,0.8,27.63,-13.02,9.72,0.03,5.27,314.78
Salinas Pueblo Missions National Monument,2014,12.15,2.92,-0.81,5.67,0.36,36.73,-12.45,11.54,0.04,0.0,298.09
Salt River Bay National Historical Park and Ecological Preserve,2014,27.33,5.19,22.83,25.08,0.5,29.72,23.94,10.98,0.25,0.0,408.35
San Antonio Missions National Historical Park,2014,20.33,2.91,12.81,16.57,0.53,40.42,-4.45,8.79,0.04,0.0,364.77
San Francisco Maritime National Historical Park,2014,14.84,2.12,9.83,12.34,0.48,33.19,3.15,7.65,0.05,0.0,331.91
San Juan National Historic Site,2014,26.96,3.86,22.19,24.58,0.59,32.18,22.33,8.42,0.09,0.0,414.82
San Juan Island National Historical Park,2014,11.03,2.31,7.62,9.33,0.6,27.57,-5.2,8.09,0.01,5.27,316.01
Sand Creek Massacre National Historic Site,2014,12.48,3.37,0.94,6.71,0.32,41.35,-18.15,13.38,0.03,0.0,305.94
Santa Monica Mountains National Recreation Area,2014,18.67,2.34,9.98,14.33,0.29,35.09,5.56,10.01,0.01,0.0,305.8
Saratoga National Historical Park,2014,7.33,0.28,3.99,5.66,0.64,31.58,-27.63,2.06,0.0,5.27,304.37
Saugus Iron Works National Historic Site,2014,8.95,0.66,5.18,7.06,0.63,31.94,-23.47,2.66,0.01,5.27,305.55
Scotts Bluff National Monument,2014,9.38,3.41,0.26,4.83,0.41,39.53,-21.17,12.55,0.06,0.0,295.82
Shenandoah National Park,2014,10.18,1.16,5.7,7.94,0.65,34.13,-19.63,5.61,0.06,0.0,319.27
Shiloh National Military Park,2014,14.74,0.52,10.41,12.58,0.73,35.98,-14.92,2.06,0.02,5.27,334.33
Sitka National Historical Park,2014,7.7,4.12,5.11,6.4,0.81,17.45,-6.3,15.64,0.05,5.27,297.93
Sleeping Bear Dunes National Lakeshore,2014,4.94,5.0,2.71,3.83,0.67,22.32,-21.72,16.32,0.05,0.0,318.52
Springfield Armory National Historic Site,2014,8.57,0.16,4.72,6.64,0.55,32.93,-23.71,1.45,0.0,5.27,303.16
Steamtown National Historic Site,2014,7.16,0.25,3.49,5.33,0.65,30.67,-22.93,2.12,0.0,0.0,305.58
Stones River National Battlefield,2014,13.73,1.7,9.4,11.57,0.74,35.69,-15.6,6.66,0.02,5.27,331.96
Sunset Crater Volcano National Monument,2014,14.13,2.52,-0.74,6.69,0.36,37.73,-6.33,12.0,0.05,0.0,285.71
Tallgrass Prairie National Preserve,2014,12.51,3.67,5.06,8.79,0.45,39.87,-22.13,11.59,0.08,0.0,322.15
Thaddeus Kosciuszko National Memorial,2014,10.75,1.89,7.0,8.87,0.67,32.25,-20.45,7.52,0.08,5.27,321.56
Theodore Roosevelt National Park,2014,5.44,3.95,-0.13,2.65,0.6,35.76,-30.05,13.82,0.02,0.0,291.4
Theodore Roosevelt Birthplace National Historic Site,2014,11.39,4.18,7.8,9.59,0.65,28.72,-12.83,11.42,0.05,5.27,320.2
Theodore Roosevelt Inaugural National Historic Site,2014,7.81,1.91,4.04,5.93,0.69,30.3,-22.2,8.02,0.02,0.0,307.55
Thomas Edison National Historical Park,2014,9.28,0.45,5.19,7.24,0.62,33.98,-24.52,2.42,0.01,5.27,316.16
Thomas Stone National Historic Site,2014,12.75,1.26,8.28,10.51,0.7,34.52,-14.55,4.59,0.02,5.27,323.56
Timpanogos Cave National Monument,2014,9.91,1.89,-0.1,4.9,0.56,36.05,-25.06,10.49,0.02,0.0,281.57
Tonto National Monument,2014,20.02,2.07,2.69,11.35,0.38,41.99,-3.05,8.16,0.02,0.0,330.82
Tuskegee Airmen National Historic Site,2014,16.98,0.41,12.29,14.63,0.7,37.81,-9.3,1.74,0.02,5.27,345.38
Tuskegee Institute National Historic Site,2014,16.98,0.41,12.29,14.63,0.7,37.81,-9.3,1.74,0.02,5.27,345.38
Tuzigoot National Monument,2014,12.39,0.67,-1.07,5.66,0.45,35.89,-8.32,2.31,0.02,0.0,296.69
Ulysses S Grant National Historic Site,2014,11.84,1.18,6.71,9.28,0.63,38.37,-22.76,6.48,0.02,0.0,323.94
Valley Forge National Historical Park,2014,10.52,0.59,6.49,8.51,0.69,33.51,-21.91,3.26,0.01,5.27,313.64
Vanderbilt Mansion National Historic Site,2014,8.01,0.22,4.3,6.15,0.64,33.01,-26.0,1.71,0.0,5.27,308.34
Vicksburg National Military Park,2014,17.01,1.9,12.58,14.8,0.71,37.1,-8.28,6.66,0.01,5.27,349.15
Vietnam Veterans Memorial,2014,11.85,2.64,7.65,9.75,0.68,33.17,-16.49,10.7,0.06,5.27,323.56
Virgin Islands National Park,2014,27.24,5.3,22.87,25.05,0.58,29.58,23.7,11.65,0.36,0.0,408.05
Voyageurs National Park,2014,1.79,1.11,-1.36,0.21,0.51,30.82,-38.07,3.36,0.02,0.0,285.08
Walnut Canyon National Monument,2014,11.87,2.32,-1.13,5.37,0.41,34.65,-8.12,9.67,0.08,0.0,285.71
War In The Pacific National Historical Park,2014,28.35,4.72,24.6,26.48,0.76,30.34,25.97,15.34,0.01,5.27,424.12
Washita Battlefield National Historic Site,2014,15.19,3.74,4.43,9.81,0.38,40.35,-14.27,11.42,0.11,0.0,328.13
Whiskeytown National Recreation Area,2014,16.52,0.8,4.44,10.48,0.52,43.36,-2.99,3.1,0.02,5.27,314.17
Whitman Mission National Historic Site,2014,12.51,2.56,3.97,8.24,0.44,40.08,-12.86,10.73,0.02,0.0,314.26
William Howard Taft National Historic Site,2014,10.88,0.49,6.38,8.63,0.7,35.35,-23.24,2.85,0.01,0.0,316.59
Wilson's Creek National Battlefield,2014,12.61,1.7,7.59,10.1,0.67,39.19,-20.98,8.14,0.05,0.0,326.45
Wind Cave National Park,2014,8.02,2.87,0.16,4.09,0.45,39.71,-23.45,10.13,0.01,0.0,294.32
Wolf Trap National Park for the Performing Arts,2014,11.36,1.91,7.07,9.21,0.7,34.67,-19.06,9.2,0.05,5.27,323.56
Women's Rights National Historical Park,2014,8.05,0.85,4.13,6.09,0.67,32.9,-21.16,4.41,0.02,0.0,308.6
World War II Memorial,2014,11.85,2.64,7.65,9.75,0.68,33.17,-16.49,10.7,0.06,5.27,323.56
Wrangell - St Elias National Park and Preserve,2014,-4.22,1.16,-7.67,-5.94,0.77,13.9,-29.05,6.88,0.01,5.27,250.15
Wright Brothers National Memorial,2014,16.46,4.59,13.01,14.73,0.73,30.26,-5.26,14.66,0.03,5.27,348.89
Wupatki National Monument,2014,14.13,2.52,-0.74,6.69,0.36,37.73,-6.33,12.0,0.05,0.0,285.71
Yellowstone National Park,2014,-0.17,0.64,-3.38,-1.77,0.62,26.47,-32.38,2.21,0.01,0.0,263.18
Yosemite National Park,2014,5.64,1.41,-4.82,0.4,0.46,30.12,-20.99,5.88,0.03,0.0,281.48
Yukon - Charley Rivers National Preserve,2014,-4.44,1.52,-6.63,-5.54,0.71,21.17,-36.79,7.27,0.01,0.0,257.98
Zion National Park,2014,9.67,1.61,-2.99,3.34,0.4,33.62,-12.69,7.2,0.02,0.0,285.17
Abraham Lincoln Birthplace National Historical Park,2015,13.65,1.69,9.76,11.71,0.72,34.57,-18.52,7.31,0.04,5.27,330.79
Adams National Historical Park,2015,9.37,0.65,5.47,7.42,0.62,34.44,-25.92,3.05,0.02,0.0,306.84
African Burial Ground National Monument,2015,12.21,4.12,8.73,10.47,0.67,29.45,-14.42,12.68,0.12,5.27,320.44
Agate Fossil Beds National Monument,2015,9.86,3.36,1.12,5.49,0.44,37.98,-17.58,13.02,0.04,0.0,298.08
Alibates Flint Quarries National Monument,2015,15.12,3.45,5.53,10.33,0.41,38.1,-11.8,12.9,0.03,0.0,325.78
Allegheny Portage Railroad National Historic Site,2015,9.39,0.27,5.4,7.39,0.61,33.56,-23.11,2.62,0.0,0.0,315.32
Amistad National Recreation Area,2015,21.19,3.32,11.77,16.48,0.48,41.36,-2.62,9.28,0.08,0.0,365.79
Andersonville National Historic Site,2015,18.98,1.73,14.54,16.76,0.58,37.88,-8.69,6.22,0.02,5.27,358.1
Andrew Johnson National Historic Site,2015,13.77,0.62,9.32,11.55,0.71,33.41,-17.65,2.67,0.02,5.27,331.27
Aniakchak National Monument and Preserve,2015,3.75,3.77,2.01,2.88,0.83,23.19,-19.09,18.17,0.03,5.27,304.0
Antietam National Battlefield,2015,11.91,1.76,7.33,9.62,0.64,35.89,-20.72,8.53,0.04,5.27,324.29
Apostle Islands National Lakeshore,2015,5.69,3.62,2.88,4.29,0.62,25.94,-22.41,12.16,0.02,0.0,300.77
Appomattox Court House National Historical Park,2015,13.84,0.11,9.01,11.43,0.7,36.44,-18.6,1.17,0.0,5.27,335.84
Arches National Park,2015,11.26,2.12,-0.53,5.37,0.44,35.67,-19.86,9.38,0.05,0.0,295.43
Arkansas Post National Memorial,2015,18.01,2.23,12.09,15.05,0.7,41.87,-9.51,8.95,0.03,5.27,351.1
Assateague Island National Seashore,2015,14.75,4.86,11.58,13.16,0.82,28.12,-10.79,15.34,0.12,5.27,334.76
Aztec Ruins National Monument,2015,10.51,2.16,0.07,5.29,0.45,34.79,-20.38,9.59,0.04,0.0,291.34
Badlands National Park,2015,10.73,3.18,2.57,6.65,0.55,39.37,-17.87,12.06,0.03,0.0,308.67
Bandelier National Monument,2015,8.43,1.32,-0.27,4.08,0.46,33.87,-20.04,5.3,0.04,0.0,296.66
Bent's Old Fort National Historic Site,2015,13.81,3.02,2.84,8.33,0.42,38.87,-12.49,11.82,0.05,0.0,307.23
Bering Land Bridge National Preserve,2015,-4.33,3.0,-5.88,-5.1,0.76,24.94,-34.85,13.48,0.05,0.0,259.57
Big Bend National Park,2015,19.9,2.38,8.08,13.99,0.41,41.55,-3.82,9.12,0.05,0.0,348.17
Big Cypress National Preserve,2015,25.46,2.4,20.24,22.85,0.37,34.55,1.91,7.69,0.05,0.0,404.24
Big Hole National Battlefield,2015,3.7,0.39,-1.97,0.87,0.48,30.81,-22.78,1.4,0.01,0.0,270.09
Big South Fork National River and Recreation Area,2015,13.3,0.16,9.73,11.51,0.71,32.5,-18.46,1.14,0.0,5.27,331.61
Big Thicket National Preserve,2015,20.16,0.11,16.17,18.16,0.8,42.83,-4.35,1.12,0.0,5.27,370.95
Bighorn Canyon National Recreation Area,2015,6.76,2.41,-1.01,2.87,0.48,33.37,-26.31,10.38,0.02,0.0,302.52
Black Canyon Of The Gunnison National Park,2015,5.39,0.72,-2.77,1.31,0.5,31.23,-26.19,3.4,0.04,0.0,279.88
Blue Ridge Parkway,2015,13.19,0.36,8.86,11.03,0.74,32.98,-19.59,1.8,0.0,5.27,323.23
Bluestone National Scenic River,2015,11.22,0.17,7.27,9.24,0.64,31.26,-20.13,1.72,0.0,5.27,322.92
Booker T Washington National Monument,2015,13.03,0.26,8.5,10.76,0.72,34.1,-19.16,1.72,0.01,5.27,327.84
Boston National Historical Park,2015,9.37,0.65,5.47,7.42,0.62,34.44,-25.92,3.05,0.02,0.0,306.84
Boston African American National Historic Site,2015,9.37,0.65,5.47,7.42,0.62,34.44,-25.92,3.05,0.02,0.0,306.84
Bryce Canyon National Park,2015,10.55,2.47,-1.63,4.46,0.4,35.8,-15.11,11.66,0.04,0.0,274.34
Buck Island Reef National Monument,2015,27.4,5.45,23.12,25.26,1.0,29.75,24.52,15.31,0.01,0.0,410.66
Buffalo National River,2015,14.15,0.3,9.8,11.97,0.71,37.26,-16.24,1.33,0.01,5.27,337.34
Cabrillo National Monument,2015,18.58,2.68,14.37,16.48,0.76,28.76,10.72,11.44,0.04,0.0,350.54
Canaveral National Seashore,2015,24.13,4.15,20.37,22.25,0.66,30.65,7.28,11.73,0.09,5.27,397.09
Cane River Creole National Historical Park,2015,19.38,0.49,15.01,17.19,0.73,42.3,-7.34,1.77,0.02,5.27,366.0
Canyonlands National Park,2015,11.48,2.32,-0.62,5.43,0.41,36.59,-15.46,9.85,0.04,0.0,295.43
Cape Cod National Seashore,2015,10.62,5.49,7.85,9.23,0.8,26.19,-12.56,20.12,0.05,5.27,320.2
Cape Hatteras National Seashore,2015,18.82,4.9,15.34,17.08,0.77,31.71,-5.57,13.82,0.12,5.27,366.08
Cape Krusenstern National Monument,2015,-4.81,3.64,-6.49,-5.64,0.79,20.87,-34.86,13.88,0.02,0.0,250.83
Cape Lookout National Seashore,2015,19.33,4.07,15.8,17.57,0.79,32.18,-5.17,10.97,0.05,5.27,371.84
Capitol Reef National Park,2015,9.39,2.28,-2.33,3.53,0.4,34.92,-17.52,10.84,0.03,0.0,277.77
Capulin Volcano National Monument,2015,11.95,3.45,1.25,6.6,0.45,36.14,-13.52,11.19,0.01,0.0,301.85
Carl Sandburg Home National Historic Site,2015,13.19,0.36,8.86,11.03,0.74,32.98,-19.59,1.8,0.0,5.27,323.23
Carlsbad Caverns National Park,2015,17.69,2.94,5.26,11.48,0.37,40.28,-6.77,10.41,0.02,0.0,328.39
Casa Grande Ruins National Monument,2015,21.28,2.17,4.85,13.06,0.34,43.94,-3.85,8.07,0.02,0.0,342.15
Castle Clinton National Monument,2015,12.21,4.12,8.73,10.47,0.67,29.45,-14.42,12.68,0.12,5.27,320.44
Catoctin Mountain Park,2015,11.91,1.76,7.33,9.62,0.64,35.89,-20.72,8.53,0.04,5.27,324.29
Cedar Breaks National Monument,2015,9.43,1.59,-1.7,3.87,0.42,35.51,-17.1,7.09,0.02,0.0,274.34
Chaco Culture National Historical Park,2015,11.12,2.55,0.48,5.8,0.44,35.56,-12.49,10.05,0.01,0.0,291.34
Chamizal National Memorial,2015,17.62,2.63,3.94,10.78,0.3,39.83,-5.58,10.88,0.01,0.0,328.06
Channel Islands National Park,2015,17.4,4.06,13.01,15.21,0.4,26.99,9.82,11.25,0.02,0.0,339.41
Charles Pinckney National Historic Site,2015,19.42,1.3,15.65,17.54,0.75,38.67,-7.17,4.09,0.04,5.27,380.36
Charles Young Buffalo Soldiers National Monument,2015,11.51,2.73,7.15,9.33,0.67,32.77,-20.52,11.8,0.02,5.27,322.51
Chattahoochee River National Recreation Area,2015,16.48,1.04,12.15,14.31,0.73,37.42,-11.44,4.21,0.02,5.27,349.46
Chesapeake and Ohio Canal National Historical Park,2015,12.79,1.88,8.13,10.46,0.66,36.03,-19.66,8.91,0.02,5.27,324.29
Chickamauga and Chattanooga National Military Park,2015,15.8,0.48,11.68,13.74,0.74,36.62,-15.0,1.74,0.01,5.27,343.45
Chickasaw National Recreation Area,2015,16.22,2.92,11.66,13.94,0.66,36.55,-8.95,11.5,0.08,5.27,345.43
Chiricahua National Monument,2015,16.22,2.4,3.94,10.08,0.4,38.98,-5.2,8.53,0.02,0.0,315.28
Christiansted National Historic Site,2015,27.58,5.38,23.1,25.33,0.8,29.93,24.68,14.89,0.28,0.0,410.66
City Of Rocks National Reserve,2015,8.67,2.5,-1.1,3.78,0.46,36.89,-22.3,10.83,0.04,0.0,299.59
Clara Barton National Historic Site,2015,13.13,2.58,8.75,10.94,0.66,35.16,-18.73,11.77,0.02,5.27,330.09
Colonial National Historical Park,2015,15.49,1.18,11.11,13.3,0.74,37.8,-17.75,4.58,0.02,5.27,339.98
Colorado National Monument,2015,10.22,2.06,-0.35,4.94,0.51,34.8,-25.03,9.44,0.02,0.0,281.68
Congaree National Park,2015,18.18,2.19,13.37,15.77,0.58,39.9,-8.74,8.14,0.01,5.27,359.73
Coronado National Memorial,2015,16.33,2.43,4.37,10.35,0.42,39.55,-5.53,9.23,0.03,0.0,309.39
Cowpens National Battlefield,2015,16.4,1.35,11.23,13.81,0.7,39.08,-13.57,5.52,0.03,5.27,337.84
Crater Lake National Park,2015,7.07,0.2,1.52,4.3,0.47,33.4,-17.63,1.27,0.0,0.0,295.21
Craters Of The Moon National Monument and Preserve,2015,10.41,2.51,-0.37,5.02,0.45,40.62,-22.48,10.37,0.03,0.0,278.79
Cumberland Gap National Historical Park,2015,13.89,0.32,9.69,11.8,0.7,34.93,-17.47,1.75,0.01,5.27,331.57
Cumberland Island National Seashore,2015,21.51,3.21,18.21,19.86,0.5,32.45,0.43,8.92,0.02,5.27,383.21
Curecanti National Recreation Area,2015,5.39,0.72,-2.77,1.31,0.5,31.23,-26.19,3.4,0.04,0.0,279.88
Cuyahoga Valley National Park,2015,10.12,3.87,6.28,8.2,0.66,30.01,-19.78,11.85,0.03,0.0,327.87
Dayton Aviation Heritage National Historical Park,2015,10.95,2.95,6.81,8.88,0.7,32.24,-20.7,11.66,0.06,5.27,322.38
De Soto National Memorial,2015,23.87,2.7,19.91,21.89,0.55,33.76,1.74,8.82,0.01,5.27,393.99
Death Valley National Park,2015,19.65,2.06,-0.1,9.77,0.27,44.29,-4.42,9.64,0.03,0.0,293.91
Delaware Water Gap National Recreation Area,2015,9.8,0.24,5.58,7.69,0.58,34.98,-26.95,2.3,0.0,5.27,310.19
Denali National Park and Preserve,2015,-1.62,1.93,-4.73,-3.17,0.79,22.05,-33.49,12.7,0.04,0.0,265.59
Devils Postpile National Monument,2015,8.29,0.5,-2.47,2.9,0.48,30.35,-19.4,1.41,0.01,0.0,283.4
Devils Tower National Monument,2015,9.17,3.34,0.32,4.74,0.45,37.45,-20.56,13.45,0.04,0.0,293.22
Dinosaur National Monument,2015,9.15,2.38,-1.78,3.69,0.41,35.09,-22.13,11.46,0.03,0.0,284.81
Edgar Allan Poe National Historic Site,2015,11.98,1.89,7.95,9.97,0.65,34.98,-21.27,7.83,0.04,5.27,327.19
Effigy Mounds National Monument,2015,8.83,3.36,4.23,6.53,0.62,34.8,-25.13,10.85,0.05,0.0,306.92
Eisenhower National Historic Site,2015,11.01,1.06,6.4,8.7,0.62,35.34,-20.38,5.59,0.02,0.0,324.29
El Malpais National Monument,2015,10.35,2.91,-0.33,5.01,0.41,35.22,-11.89,11.05,0.01,0.0,295.58
El Morro National Monument,2015,10.35,2.91,-0.33,5.01,0.41,35.22,-11.89,11.05,0.01,0.0,288.4
Eleanor Roosevelt National Historic Site,2015,8.76,0.23,4.89,6.83,0.62,35.15,-27.11,2.3,0.0,5.27,311.21
Eugene O'Neill National Historic Site,2015,15.44,2.64,8.8,12.12,0.42,40.65,-2.31,8.04,0.05,0.0,329.12
Everglades National Park,2015,26.37,3.92,21.26,23.81,0.41,32.44,7.9,11.49,0.07,5.27,412.55
Federal Hall National Memorial,2015,12.21,4.12,8.73,10.47,0.67,29.45,-14.42,12.68,0.12,5.27,320.44
Fire Island National Seashore,2015,12.32,5.06,9.14,10.73,0.78,27.89,-13.08,14.62,0.08,5.27,324.6
First Ladies National Historic Site,2015,10.01,1.1,5.63,7.83,0.66,34.37,-23.52,5.36,0.03,0.0,320.23
Flight 93 National Memorial,2015,9.94,0.29,5.63,7.79,0.61,33.56,-20.92,2.48,0.0,0.0,315.32
Florissant Fossil Beds National Monument,2015,7.44,2.41,-1.81,2.82,0.45,31.0,-16.99,11.68,0.01,0.0,274.09
Fort Bowie National Historic Site,2015,16.22,2.4,3.94,10.08,0.4,38.98,-5.2,8.53,0.02,0.0,315.28
Fort Davis National Historic Site,2015,17.08,3.13,6.05,11.57,0.44,37.87,-6.92,10.97,0.05,0.0,328.21
Fort Donelson National Battlefield,2015,15.08,1.25,10.64,12.86,0.76,36.77,-16.67,4.55,0.02,5.27,337.44
Fort Frederica National Monument,2015,21.51,3.21,18.21,19.86,0.5,32.45,0.43,8.92,0.02,5.27,376.44
Fort Laramie National Historic Site,2015,10.78,3.23,0.76,5.77,0.4,38.62,-17.07,12.15,0.07,0.0,300.41
Fort Larned National Historic Site,2015,14.03,3.54,6.13,10.08,0.46,41.57,-14.28,10.42,0.04,0.0,324.62
Fort Matanzas National Monument,2015,22.43,1.48,19.16,20.8,0.62,34.48,0.25,4.91,0.05,5.27,386.51
Fort Necessity National Battlefield,2015,10.01,0.41,5.8,7.9,0.66,33.83,-20.97,2.99,0.0,0.0,321.76
Fort Point National Historic Site,2015,14.48,2.16,9.88,12.18,0.54,33.48,1.11,8.1,0.04,0.0,329.12
Fort Pulaski National Monument,2015,21.09,4.58,17.68,19.38,0.63,31.62,-0.65,12.62,0.04,5.27,370.4
Fort Raleigh National Historic Site,2015,17.31,4.44,14.01,15.66,0.74,32.22,-7.8,13.41,0.08,5.27,366.08
Fort Scott National Historic Site,2015,13.51,3.01,9.05,11.28,0.67,33.95,-15.5,11.14,0.06,5.27,332.17
Fort Smith National Historic Site,2015,15.78,1.69,11.39,13.58,0.74,37.34,-13.06,6.9,0.02,5.27,342.44
Fort Stanwix National Monument,2015,7.52,0.45,4.1,5.81,0.73,32.33,-26.63,3.26,0.0,5.27,307.46
Fort Union National Monument,2015,9.76,1.58,0.23,4.99,0.43,35.64,-14.41,6.26,0.05,0.0,292.1
Fort Union Trading Post National Historic Site,2015,7.81,3.53,0.29,4.05,0.45,38.54,-26.17,14.27,0.03,0.0,295.66
Fort Vancouver National Historic Site,2015,11.89,0.76,7.33,9.61,0.73,40.32,-6.27,3.17,0.01,5.27,312.97
Fossil Butte National Monument,2015,5.04,1.84,-2.31,1.37,0.51,31.12,-25.62,7.15,0.04,0.0,279.77
Franklin Delano Roosevelt Memorial,2015,13.13,2.58,8.75,10.94,0.66,35.16,-18.73,11.77,0.02,5.27,330.09
Frederick Douglass National Historic Site,2015,13.13,2.58,8.75,10.94,0.66,35.16,-18.73,11.77,0.02,5.27,332.9
Frederick Law Olmsted National Historic Site,2015,9.37,0.65,5.47,7.42,0.62,34.44,-25.92,3.05,0.02,0.0,306.84
Friendship Hill National Historic Site,2015,11.05,0.22,6.45,8.75,0.65,34.7,-19.85,2.35,0.0,0.0,321.76
Gates Of The Arctic National Park and Preserve,2015,-9.29,1.81,-10.66,-9.98,0.88,19.44,-39.73,6.92,0.01,0.0,238.17
Gateway National Recreation Area,2015,12.21,4.12,8.73,10.47,0.67,29.45,-14.42,12.68,0.12,5.27,324.6
Gauley River National Recreation Area,2015,12.08,0.18,7.66,9.87,0.62,33.58,-19.86,1.82,0.0,5.27,331.73
General Grant National Memorial,2015,10.92,1.55,6.89,8.9,0.58,34.75,-23.6,6.23,0.06,5.27,324.6
George Rogers Clark National Historical Park,2015,12.92,2.73,9.12,11.02,0.75,32.3,-19.08,10.38,0.05,5.27,329.0
George Washington Birthplace National Monument,2015,14.43,0.75,10.01,12.23,0.72,35.65,-15.03,3.3,0.02,5.27,332.9
George Washington Carver National Monument,2015,14.06,2.84,9.83,11.94,0.76,35.88,-15.79,10.04,0.04,5.27,334.39
Gettysburg National Military Park,2015,11.01,1.06,6.4,8.7,0.62,35.34,-20.38,5.59,0.02,0.0,324.29
Gila Cliff Dwellings National Monument,2015,11.76,0.95,1.53,6.64,0.49,36.89,-9.98,3.44,0.0,0.0,286.44
Glacier National Park,2015,2.95,0.43,-1.63,0.66,0.64,31.48,-28.77,1.62,0.0,0.0,282.5
Glacier Bay National Park and Preserve,2015,-0.88,1.84,-2.35,-1.62,0.75,16.23,-30.6,11.7,0.05,10.55,289.98
Glen Canyon National Recreation Area,2015,13.61,2.05,0.3,6.95,0.38,39.56,-12.56,10.36,0.02,0.0,295.8
Golden Gate National Recreation Area,2015,14.48,2.16,9.88,12.18,0.54,33.48,1.11,8.1,0.04,0.0,329.12
Governors Island National Monument,2015,12.21,4.12,8.73,10.47,0.67,29.45,-14.42,12.68,0.12,5.27,320.44
